PeriodKey,Period,Period Start,Period End,Period Type,Period Frequency
"rollingweek_2019_12_29","Week end 29/12/2019",2019-12-23 00:00:00.000,2019-12-29 23:59:59.000,"Rolling week","Weekly"
"rollingweek_2019_12_30","Week end 30/12/2019",2019-12-24 00:00:00.000,2019-12-30 23:59:59.000,"Rolling week","Weekly"
"rollingweek_2019_12_31","Week end 31/12/2019",2019-12-25 00:00:00.000,2019-12-31 23:59:59.000,"Rolling week","Weekly"
"rollingweek_2020_01_01","Week end 01/01/2020",2019-12-26 00:00:00.000,2020-01-01 23:59:59.000,"Rolling week","Weekly"
"rollingweek_2020_01_02","Week end 02/01/2020",2019-12-27 00:00:00.000,2020-01-02 23:59:59.000,"Rolling week","Weekly"
"rollingweek_2020_01_03","Week end 03/01/2020",2019-12-28 00:00:00.000,2020-01-03 23:59:59.000,"Rolling week","Weekly"
"rollingweek_2020_01_04","Week end 04/01/2020",2019-12-29 00:00:00.000,2020-01-04 23:59:59.000,"Rolling week","Weekly"
"rollingweek_2020_01_05","Week end 05/01/2020",2019-12-30 00:00:00.000,2020-01-05 23:59:59.000,"Rolling week","Weekly"
"rollingweek_2020_01_06","Week end 06/01/2020",2019-12-31 00:00:00.000,2020-01-06 23:59:59.000,"Rolling week","Weekly"
"rollingweek_2020_01_07","Week end 07/01/2020",2020-01-01 00:00:00.000,2020-01-07 23:59:59.000,"Rolling week","Weekly"
"rollingweek_2020_01_08","Week end 08/01/2020",2020-01-02 00:00:00.000,2020-01-08 23:59:59.000,"Rolling week","Weekly"
"rollingweek_2020_01_09","Week end 09/01/2020",2020-01-03 00:00:00.000,2020-01-09 23:59:59.000,"Rolling week","Weekly"
"rollingweek_2020_01_10","Week end 10/01/2020",2020-01-04 00:00:00.000,2020-01-10 23:59:59.000,"Rolling week","Weekly"
"rollingweek_2020_01_11","Week end 11/01/2020",2020-01-05 00:00:00.000,2020-01-11 23:59:59.000,"Rolling week","Weekly"
"rollingweek_2020_01_12","Week end 12/01/2020",2020-01-06 00:00:00.000,2020-01-12 23:59:59.000,"Rolling week","Weekly"
"rollingweek_2020_01_13","Week end 13/01/2020",2020-01-07 00:00:00.000,2020-01-13 23:59:59.000,"Rolling week","Weekly"
"rollingweek_2020_01_14","Week end 14/01/2020",2020-01-08 00:00:00.000,2020-01-14 23:59:59.000,"Rolling week","Weekly"
"rollingweek_2020_01_15","Week end 15/01/2020",2020-01-09 00:00:00.000,2020-01-15 23:59:59.000,"Rolling week","Weekly"
"rollingweek_2020_01_16","Week end 16/01/2020",2020-01-10 00:00:00.000,2020-01-16 23:59:59.000,"Rolling week","Weekly"
"rollingweek_2020_01_17","Week end 17/01/2020",2020-01-11 00:00:00.000,2020-01-17 23:59:59.000,"Rolling week","Weekly"
"rollingweek_2020_01_18","Week end 18/01/2020",2020-01-12 00:00:00.000,2020-01-18 23:59:59.000,"Rolling week","Weekly"
"rollingweek_2020_01_19","Week end 19/01/2020",2020-01-13 00:00:00.000,2020-01-19 23:59:59.000,"Rolling week","Weekly"
"rollingweek_2020_01_20","Week end 20/01/2020",2020-01-14 00:00:00.000,2020-01-20 23:59:59.000,"Rolling week","Weekly"
"rollingweek_2020_01_21","Week end 21/01/2020",2020-01-15 00:00:00.000,2020-01-21 23:59:59.000,"Rolling week","Weekly"
"rollingweek_2020_01_22","Week end 22/01/2020",2020-01-16 00:00:00.000,2020-01-22 23:59:59.000,"Rolling week","Weekly"
"rollingweek_2020_01_23","Week end 23/01/2020",2020-01-17 00:00:00.000,2020-01-23 23:59:59.000,"Rolling week","Weekly"
"rollingweek_2020_01_24","Week end 24/01/2020",2020-01-18 00:00:00.000,2020-01-24 23:59:59.000,"Rolling week","Weekly"
"rollingweek_2020_01_25","Week end 25/01/2020",2020-01-19 00:00:00.000,2020-01-25 23:59:59.000,"Rolling week","Weekly"
"rollingweek_2020_01_26","Week end 26/01/2020",2020-01-20 00:00:00.000,2020-01-26 23:59:59.000,"Rolling week","Weekly"
"rollingweek_2020_01_27","Week end 27/01/2020",2020-01-21 00:00:00.000,2020-01-27 23:59:59.000,"Rolling week","Weekly"
"rollingweek_2020_01_28","Week end 28/01/2020",2020-01-22 00:00:00.000,2020-01-28 23:59:59.000,"Rolling week","Weekly"
"rollingweek_2020_01_29","Week end 29/01/2020",2020-01-23 00:00:00.000,2020-01-29 23:59:59.000,"Rolling week","Weekly"
"rollingweek_2020_01_30","Week end 30/01/2020",2020-01-24 00:00:00.000,2020-01-30 23:59:59.000,"Rolling week","Weekly"
"rollingweek_2020_01_31","Week end 31/01/2020",2020-01-25 00:00:00.000,2020-01-31 23:59:59.000,"Rolling week","Weekly"
"rollingweek_2020_02_01","Week end 01/02/2020",2020-01-26 00:00:00.000,2020-02-01 23:59:59.000,"Rolling week","Weekly"
"rollingweek_2020_02_02","Week end 02/02/2020",2020-01-27 00:00:00.000,2020-02-02 23:59:59.000,"Rolling week","Weekly"
"rollingweek_2020_02_03","Week end 03/02/2020",2020-01-28 00:00:00.000,2020-02-03 23:59:59.000,"Rolling week","Weekly"
"rollingweek_2020_02_04","Week end 04/02/2020",2020-01-29 00:00:00.000,2020-02-04 23:59:59.000,"Rolling week","Weekly"
"rollingweek_2020_02_05","Week end 05/02/2020",2020-01-30 00:00:00.000,2020-02-05 23:59:59.000,"Rolling week","Weekly"
"rollingweek_2020_02_06","Week end 06/02/2020",2020-01-31 00:00:00.000,2020-02-06 23:59:59.000,"Rolling week","Weekly"
"rollingweek_2020_02_07","Week end 07/02/2020",2020-02-01 00:00:00.000,2020-02-07 23:59:59.000,"Rolling week","Weekly"
"rollingweek_2020_02_08","Week end 08/02/2020",2020-02-02 00:00:00.000,2020-02-08 23:59:59.000,"Rolling week","Weekly"
"rollingweek_2020_02_09","Week end 09/02/2020",2020-02-03 00:00:00.000,2020-02-09 23:59:59.000,"Rolling week","Weekly"
"rollingweek_2020_02_10","Week end 10/02/2020",2020-02-04 00:00:00.000,2020-02-10 23:59:59.000,"Rolling week","Weekly"
"rollingweek_2020_02_11","Week end 11/02/2020",2020-02-05 00:00:00.000,2020-02-11 23:59:59.000,"Rolling week","Weekly"
"rollingweek_2020_02_12","Week end 12/02/2020",2020-02-06 00:00:00.000,2020-02-12 23:59:59.000,"Rolling week","Weekly"
"rollingweek_2020_02_13","Week end 13/02/2020",2020-02-07 00:00:00.000,2020-02-13 23:59:59.000,"Rolling week","Weekly"
"rollingweek_2020_02_14","Week end 14/02/2020",2020-02-08 00:00:00.000,2020-02-14 23:59:59.000,"Rolling week","Weekly"
"rollingweek_2020_02_15","Week end 15/02/2020",2020-02-09 00:00:00.000,2020-02-15 23:59:59.000,"Rolling week","Weekly"
"rollingweek_2020_02_16","Week end 16/02/2020",2020-02-10 00:00:00.000,2020-02-16 23:59:59.000,"Rolling week","Weekly"
"rollingweek_2020_02_17","Week end 17/02/2020",2020-02-11 00:00:00.000,2020-02-17 23:59:59.000,"Rolling week","Weekly"
"rollingweek_2020_02_18","Week end 18/02/2020",2020-02-12 00:00:00.000,2020-02-18 23:59:59.000,"Rolling week","Weekly"
"rollingweek_2020_02_19","Week end 19/02/2020",2020-02-13 00:00:00.000,2020-02-19 23:59:59.000,"Rolling week","Weekly"
"rollingweek_2020_02_20","Week end 20/02/2020",2020-02-14 00:00:00.000,2020-02-20 23:59:59.000,"Rolling week","Weekly"
"rollingweek_2020_02_21","Week end 21/02/2020",2020-02-15 00:00:00.000,2020-02-21 23:59:59.000,"Rolling week","Weekly"
"rollingweek_2020_02_22","Week end 22/02/2020",2020-02-16 00:00:00.000,2020-02-22 23:59:59.000,"Rolling week","Weekly"
"rollingweek_2020_02_23","Week end 23/02/2020",2020-02-17 00:00:00.000,2020-02-23 23:59:59.000,"Rolling week","Weekly"
"rollingweek_2020_02_24","Week end 24/02/2020",2020-02-18 00:00:00.000,2020-02-24 23:59:59.000,"Rolling week","Weekly"
"rollingweek_2020_02_25","Week end 25/02/2020",2020-02-19 00:00:00.000,2020-02-25 23:59:59.000,"Rolling week","Weekly"
"rollingweek_2020_02_26","Week end 26/02/2020",2020-02-20 00:00:00.000,2020-02-26 23:59:59.000,"Rolling week","Weekly"
"rollingweek_2020_02_27","Week end 27/02/2020",2020-02-21 00:00:00.000,2020-02-27 23:59:59.000,"Rolling week","Weekly"
"rollingweek_2020_02_28","Week end 28/02/2020",2020-02-22 00:00:00.000,2020-02-28 23:59:59.000,"Rolling week","Weekly"
"rollingweek_2020_02_29","Week end 29/02/2020",2020-02-23 00:00:00.000,2020-02-29 23:59:59.000,"Rolling week","Weekly"
"rollingweek_2020_03_01","Week end 01/03/2020",2020-02-24 00:00:00.000,2020-03-01 23:59:59.000,"Rolling week","Weekly"
"rollingweek_2020_03_02","Week end 02/03/2020",2020-02-25 00:00:00.000,2020-03-02 23:59:59.000,"Rolling week","Weekly"
"rollingweek_2020_03_03","Week end 03/03/2020",2020-02-26 00:00:00.000,2020-03-03 23:59:59.000,"Rolling week","Weekly"
"rollingweek_2020_03_04","Week end 04/03/2020",2020-02-27 00:00:00.000,2020-03-04 23:59:59.000,"Rolling week","Weekly"
"rollingweek_2020_03_05","Week end 05/03/2020",2020-02-28 00:00:00.000,2020-03-05 23:59:59.000,"Rolling week","Weekly"
"rollingweek_2020_03_06","Week end 06/03/2020",2020-02-29 00:00:00.000,2020-03-06 23:59:59.000,"Rolling week","Weekly"
"rollingweek_2020_03_07","Week end 07/03/2020",2020-03-01 00:00:00.000,2020-03-07 23:59:59.000,"Rolling week","Weekly"
"rollingweek_2020_03_08","Week end 08/03/2020",2020-03-02 00:00:00.000,2020-03-08 23:59:59.000,"Rolling week","Weekly"
"rollingweek_2020_03_09","Week end 09/03/2020",2020-03-03 00:00:00.000,2020-03-09 23:59:59.000,"Rolling week","Weekly"
"rollingweek_2020_03_10","Week end 10/03/2020",2020-03-04 00:00:00.000,2020-03-10 23:59:59.000,"Rolling week","Weekly"
"rollingweek_2020_03_11","Week end 11/03/2020",2020-03-05 00:00:00.000,2020-03-11 23:59:59.000,"Rolling week","Weekly"
"rollingweek_2020_03_12","Week end 12/03/2020",2020-03-06 00:00:00.000,2020-03-12 23:59:59.000,"Rolling week","Weekly"
"rollingweek_2020_03_13","Week end 13/03/2020",2020-03-07 00:00:00.000,2020-03-13 23:59:59.000,"Rolling week","Weekly"
"rollingweek_2020_03_14","Week end 14/03/2020",2020-03-08 00:00:00.000,2020-03-14 23:59:59.000,"Rolling week","Weekly"
"rollingweek_2020_03_15","Week end 15/03/2020",2020-03-09 00:00:00.000,2020-03-15 23:59:59.000,"Rolling week","Weekly"
"rollingweek_2020_03_16","Week end 16/03/2020",2020-03-10 00:00:00.000,2020-03-16 23:59:59.000,"Rolling week","Weekly"
"rollingweek_2020_03_17","Week end 17/03/2020",2020-03-11 00:00:00.000,2020-03-17 23:59:59.000,"Rolling week","Weekly"
"rollingweek_2020_03_18","Week end 18/03/2020",2020-03-12 00:00:00.000,2020-03-18 23:59:59.000,"Rolling week","Weekly"
"rollingweek_2020_03_19","Week end 19/03/2020",2020-03-13 00:00:00.000,2020-03-19 23:59:59.000,"Rolling week","Weekly"
"rollingweek_2020_03_20","Week end 20/03/2020",2020-03-14 00:00:00.000,2020-03-20 23:59:59.000,"Rolling week","Weekly"
"rollingweek_2020_03_21","Week end 21/03/2020",2020-03-15 00:00:00.000,2020-03-21 23:59:59.000,"Rolling week","Weekly"
"rollingweek_2020_03_22","Week end 22/03/2020",2020-03-16 00:00:00.000,2020-03-22 23:59:59.000,"Rolling week","Weekly"
"rollingweek_2020_03_23","Week end 23/03/2020",2020-03-17 00:00:00.000,2020-03-23 23:59:59.000,"Rolling week","Weekly"
"rollingweek_2020_03_24","Week end 24/03/2020",2020-03-18 00:00:00.000,2020-03-24 23:59:59.000,"Rolling week","Weekly"
"rollingweek_2020_03_25","Week end 25/03/2020",2020-03-19 00:00:00.000,2020-03-25 23:59:59.000,"Rolling week","Weekly"
"rollingweek_2020_03_26","Week end 26/03/2020",2020-03-20 00:00:00.000,2020-03-26 23:59:59.000,"Rolling week","Weekly"
"rollingweek_2020_03_27","Week end 27/03/2020",2020-03-21 00:00:00.000,2020-03-27 23:59:59.000,"Rolling week","Weekly"
"rollingweek_2020_03_28","Week end 28/03/2020",2020-03-22 00:00:00.000,2020-03-28 23:59:59.000,"Rolling week","Weekly"
"rollingweek_2020_03_29","Week end 29/03/2020",2020-03-23 00:00:00.000,2020-03-29 23:59:59.000,"Rolling week","Weekly"
"rollingweek_2020_03_30","Week end 30/03/2020",2020-03-24 00:00:00.000,2020-03-30 23:59:59.000,"Rolling week","Weekly"
"rollingweek_2020_03_31","Week end 31/03/2020",2020-03-25 00:00:00.000,2020-03-31 23:59:59.000,"Rolling week","Weekly"
"rollingweek_2020_04_01","Week end 01/04/2020",2020-03-26 00:00:00.000,2020-04-01 23:59:59.000,"Rolling week","Weekly"
"rollingweek_2020_04_02","Week end 02/04/2020",2020-03-27 00:00:00.000,2020-04-02 23:59:59.000,"Rolling week","Weekly"
"rollingweek_2020_04_03","Week end 03/04/2020",2020-03-28 00:00:00.000,2020-04-03 23:59:59.000,"Rolling week","Weekly"
"rollingweek_2020_04_04","Week end 04/04/2020",2020-03-29 00:00:00.000,2020-04-04 23:59:59.000,"Rolling week","Weekly"
"rollingweek_2020_04_05","Week end 05/04/2020",2020-03-30 00:00:00.000,2020-04-05 23:59:59.000,"Rolling week","Weekly"
"rollingweek_2020_04_06","Week end 06/04/2020",2020-03-31 00:00:00.000,2020-04-06 23:59:59.000,"Rolling week","Weekly"
"rollingweek_2020_04_07","Week end 07/04/2020",2020-04-01 00:00:00.000,2020-04-07 23:59:59.000,"Rolling week","Weekly"
"rollingweek_2020_04_08","Week end 08/04/2020",2020-04-02 00:00:00.000,2020-04-08 23:59:59.000,"Rolling week","Weekly"
"rollingweek_2020_04_09","Week end 09/04/2020",2020-04-03 00:00:00.000,2020-04-09 23:59:59.000,"Rolling week","Weekly"
"rollingweek_2020_04_10","Week end 10/04/2020",2020-04-04 00:00:00.000,2020-04-10 23:59:59.000,"Rolling week","Weekly"
"rollingweek_2020_04_11","Week end 11/04/2020",2020-04-05 00:00:00.000,2020-04-11 23:59:59.000,"Rolling week","Weekly"
"rollingweek_2020_04_12","Week end 12/04/2020",2020-04-06 00:00:00.000,2020-04-12 23:59:59.000,"Rolling week","Weekly"
"rollingweek_2020_04_13","Week end 13/04/2020",2020-04-07 00:00:00.000,2020-04-13 23:59:59.000,"Rolling week","Weekly"
"rollingweek_2020_04_14","Week end 14/04/2020",2020-04-08 00:00:00.000,2020-04-14 23:59:59.000,"Rolling week","Weekly"
"rollingweek_2020_04_15","Week end 15/04/2020",2020-04-09 00:00:00.000,2020-04-15 23:59:59.000,"Rolling week","Weekly"
"rollingweek_2020_04_16","Week end 16/04/2020",2020-04-10 00:00:00.000,2020-04-16 23:59:59.000,"Rolling week","Weekly"
"rollingweek_2020_04_17","Week end 17/04/2020",2020-04-11 00:00:00.000,2020-04-17 23:59:59.000,"Rolling week","Weekly"
"rollingweek_2020_04_18","Week end 18/04/2020",2020-04-12 00:00:00.000,2020-04-18 23:59:59.000,"Rolling week","Weekly"
"rollingweek_2020_04_19","Week end 19/04/2020",2020-04-13 00:00:00.000,2020-04-19 23:59:59.000,"Rolling week","Weekly"
"rollingweek_2020_04_20","Week end 20/04/2020",2020-04-14 00:00:00.000,2020-04-20 23:59:59.000,"Rolling week","Weekly"
"rollingweek_2020_04_21","Week end 21/04/2020",2020-04-15 00:00:00.000,2020-04-21 23:59:59.000,"Rolling week","Weekly"
"rollingweek_2020_04_22","Week end 22/04/2020",2020-04-16 00:00:00.000,2020-04-22 23:59:59.000,"Rolling week","Weekly"
"rollingweek_2020_04_23","Week end 23/04/2020",2020-04-17 00:00:00.000,2020-04-23 23:59:59.000,"Rolling week","Weekly"
"rollingweek_2020_04_24","Week end 24/04/2020",2020-04-18 00:00:00.000,2020-04-24 23:59:59.000,"Rolling week","Weekly"
"rollingweek_2020_04_25","Week end 25/04/2020",2020-04-19 00:00:00.000,2020-04-25 23:59:59.000,"Rolling week","Weekly"
"rollingweek_2020_04_26","Week end 26/04/2020",2020-04-20 00:00:00.000,2020-04-26 23:59:59.000,"Rolling week","Weekly"
"rollingweek_2020_04_27","Week end 27/04/2020",2020-04-21 00:00:00.000,2020-04-27 23:59:59.000,"Rolling week","Weekly"
"rollingweek_2020_04_28","Week end 28/04/2020",2020-04-22 00:00:00.000,2020-04-28 23:59:59.000,"Rolling week","Weekly"
"rollingweek_2020_04_29","Week end 29/04/2020",2020-04-23 00:00:00.000,2020-04-29 23:59:59.000,"Rolling week","Weekly"
"rollingweek_2020_04_30","Week end 30/04/2020",2020-04-24 00:00:00.000,2020-04-30 23:59:59.000,"Rolling week","Weekly"
"rollingweek_2020_05_01","Week end 01/05/2020",2020-04-25 00:00:00.000,2020-05-01 23:59:59.000,"Rolling week","Weekly"
"rollingweek_2020_05_02","Week end 02/05/2020",2020-04-26 00:00:00.000,2020-05-02 23:59:59.000,"Rolling week","Weekly"
"rollingweek_2020_05_03","Week end 03/05/2020",2020-04-27 00:00:00.000,2020-05-03 23:59:59.000,"Rolling week","Weekly"
"rollingweek_2020_05_04","Week end 04/05/2020",2020-04-28 00:00:00.000,2020-05-04 23:59:59.000,"Rolling week","Weekly"
"rollingweek_2020_05_05","Week end 05/05/2020",2020-04-29 00:00:00.000,2020-05-05 23:59:59.000,"Rolling week","Weekly"
"rollingweek_2020_05_06","Week end 06/05/2020",2020-04-30 00:00:00.000,2020-05-06 23:59:59.000,"Rolling week","Weekly"
"rollingweek_2020_05_07","Week end 07/05/2020",2020-05-01 00:00:00.000,2020-05-07 23:59:59.000,"Rolling week","Weekly"
"rollingweek_2020_05_08","Week end 08/05/2020",2020-05-02 00:00:00.000,2020-05-08 23:59:59.000,"Rolling week","Weekly"
"rollingweek_2020_05_09","Week end 09/05/2020",2020-05-03 00:00:00.000,2020-05-09 23:59:59.000,"Rolling week","Weekly"
"rollingweek_2020_05_10","Week end 10/05/2020",2020-05-04 00:00:00.000,2020-05-10 23:59:59.000,"Rolling week","Weekly"
"rollingweek_2020_05_11","Week end 11/05/2020",2020-05-05 00:00:00.000,2020-05-11 23:59:59.000,"Rolling week","Weekly"
"rollingweek_2020_05_12","Week end 12/05/2020",2020-05-06 00:00:00.000,2020-05-12 23:59:59.000,"Rolling week","Weekly"
"rollingweek_2020_05_13","Week end 13/05/2020",2020-05-07 00:00:00.000,2020-05-13 23:59:59.000,"Rolling week","Weekly"
"rollingweek_2020_05_14","Week end 14/05/2020",2020-05-08 00:00:00.000,2020-05-14 23:59:59.000,"Rolling week","Weekly"
"rollingweek_2020_05_15","Week end 15/05/2020",2020-05-09 00:00:00.000,2020-05-15 23:59:59.000,"Rolling week","Weekly"
"rollingweek_2020_05_16","Week end 16/05/2020",2020-05-10 00:00:00.000,2020-05-16 23:59:59.000,"Rolling week","Weekly"
"rollingweek_2020_05_17","Week end 17/05/2020",2020-05-11 00:00:00.000,2020-05-17 23:59:59.000,"Rolling week","Weekly"
"rollingweek_2020_05_18","Week end 18/05/2020",2020-05-12 00:00:00.000,2020-05-18 23:59:59.000,"Rolling week","Weekly"
"rollingweek_2020_05_19","Week end 19/05/2020",2020-05-13 00:00:00.000,2020-05-19 23:59:59.000,"Rolling week","Weekly"
"rollingweek_2020_05_20","Week end 20/05/2020",2020-05-14 00:00:00.000,2020-05-20 23:59:59.000,"Rolling week","Weekly"
"rollingweek_2020_05_21","Week end 21/05/2020",2020-05-15 00:00:00.000,2020-05-21 23:59:59.000,"Rolling week","Weekly"
"rollingweek_2020_05_22","Week end 22/05/2020",2020-05-16 00:00:00.000,2020-05-22 23:59:59.000,"Rolling week","Weekly"
"rollingweek_2020_05_23","Week end 23/05/2020",2020-05-17 00:00:00.000,2020-05-23 23:59:59.000,"Rolling week","Weekly"
"rollingweek_2020_05_24","Week end 24/05/2020",2020-05-18 00:00:00.000,2020-05-24 23:59:59.000,"Rolling week","Weekly"
"rollingweek_2020_05_25","Week end 25/05/2020",2020-05-19 00:00:00.000,2020-05-25 23:59:59.000,"Rolling week","Weekly"
"rollingweek_2020_05_26","Week end 26/05/2020",2020-05-20 00:00:00.000,2020-05-26 23:59:59.000,"Rolling week","Weekly"
"rollingweek_2020_05_27","Week end 27/05/2020",2020-05-21 00:00:00.000,2020-05-27 23:59:59.000,"Rolling week","Weekly"
"rollingweek_2020_05_28","Week end 28/05/2020",2020-05-22 00:00:00.000,2020-05-28 23:59:59.000,"Rolling week","Weekly"
"rollingweek_2020_05_29","Week end 29/05/2020",2020-05-23 00:00:00.000,2020-05-29 23:59:59.000,"Rolling week","Weekly"
"rollingweek_2020_05_30","Week end 30/05/2020",2020-05-24 00:00:00.000,2020-05-30 23:59:59.000,"Rolling week","Weekly"
"rollingweek_2020_05_31","Week end 31/05/2020",2020-05-25 00:00:00.000,2020-05-31 23:59:59.000,"Rolling week","Weekly"
"rollingweek_2020_06_01","Week end 01/06/2020",2020-05-26 00:00:00.000,2020-06-01 23:59:59.000,"Rolling week","Weekly"
"rollingweek_2020_06_02","Week end 02/06/2020",2020-05-27 00:00:00.000,2020-06-02 23:59:59.000,"Rolling week","Weekly"
"rollingweek_2020_06_03","Week end 03/06/2020",2020-05-28 00:00:00.000,2020-06-03 23:59:59.000,"Rolling week","Weekly"
"rollingweek_2020_06_04","Week end 04/06/2020",2020-05-29 00:00:00.000,2020-06-04 23:59:59.000,"Rolling week","Weekly"
"rollingweek_2020_06_05","Week end 05/06/2020",2020-05-30 00:00:00.000,2020-06-05 23:59:59.000,"Rolling week","Weekly"
"rollingweek_2020_06_06","Week end 06/06/2020",2020-05-31 00:00:00.000,2020-06-06 23:59:59.000,"Rolling week","Weekly"
"rollingweek_2020_06_07","Week end 07/06/2020",2020-06-01 00:00:00.000,2020-06-07 23:59:59.000,"Rolling week","Weekly"
"rollingweek_2020_06_08","Week end 08/06/2020",2020-06-02 00:00:00.000,2020-06-08 23:59:59.000,"Rolling week","Weekly"
"rollingweek_2020_06_09","Week end 09/06/2020",2020-06-03 00:00:00.000,2020-06-09 23:59:59.000,"Rolling week","Weekly"
"rollingweek_2020_06_10","Week end 10/06/2020",2020-06-04 00:00:00.000,2020-06-10 23:59:59.000,"Rolling week","Weekly"
"rollingweek_2020_06_11","Week end 11/06/2020",2020-06-05 00:00:00.000,2020-06-11 23:59:59.000,"Rolling week","Weekly"
"rollingweek_2020_06_12","Week end 12/06/2020",2020-06-06 00:00:00.000,2020-06-12 23:59:59.000,"Rolling week","Weekly"
"rollingweek_2020_06_13","Week end 13/06/2020",2020-06-07 00:00:00.000,2020-06-13 23:59:59.000,"Rolling week","Weekly"
"rollingweek_2020_06_14","Week end 14/06/2020",2020-06-08 00:00:00.000,2020-06-14 23:59:59.000,"Rolling week","Weekly"
"rollingweek_2020_06_15","Week end 15/06/2020",2020-06-09 00:00:00.000,2020-06-15 23:59:59.000,"Rolling week","Weekly"
"rollingweek_2020_06_16","Week end 16/06/2020",2020-06-10 00:00:00.000,2020-06-16 23:59:59.000,"Rolling week","Weekly"
"rollingweek_2020_06_17","Week end 17/06/2020",2020-06-11 00:00:00.000,2020-06-17 23:59:59.000,"Rolling week","Weekly"
"rollingweek_2020_06_18","Week end 18/06/2020",2020-06-12 00:00:00.000,2020-06-18 23:59:59.000,"Rolling week","Weekly"
"rollingweek_2020_06_19","Week end 19/06/2020",2020-06-13 00:00:00.000,2020-06-19 23:59:59.000,"Rolling week","Weekly"
"rollingweek_2020_06_20","Week end 20/06/2020",2020-06-14 00:00:00.000,2020-06-20 23:59:59.000,"Rolling week","Weekly"
"rollingweek_2020_06_21","Week end 21/06/2020",2020-06-15 00:00:00.000,2020-06-21 23:59:59.000,"Rolling week","Weekly"
"rollingweek_2020_06_22","Week end 22/06/2020",2020-06-16 00:00:00.000,2020-06-22 23:59:59.000,"Rolling week","Weekly"
"rollingweek_2020_06_23","Week end 23/06/2020",2020-06-17 00:00:00.000,2020-06-23 23:59:59.000,"Rolling week","Weekly"
"rollingweek_2020_06_24","Week end 24/06/2020",2020-06-18 00:00:00.000,2020-06-24 23:59:59.000,"Rolling week","Weekly"
"rollingweek_2020_06_25","Week end 25/06/2020",2020-06-19 00:00:00.000,2020-06-25 23:59:59.000,"Rolling week","Weekly"
"rollingweek_2020_06_26","Week end 26/06/2020",2020-06-20 00:00:00.000,2020-06-26 23:59:59.000,"Rolling week","Weekly"
"rollingweek_2020_06_27","Week end 27/06/2020",2020-06-21 00:00:00.000,2020-06-27 23:59:59.000,"Rolling week","Weekly"
"rollingweek_2020_06_28","Week end 28/06/2020",2020-06-22 00:00:00.000,2020-06-28 23:59:59.000,"Rolling week","Weekly"
"rollingweek_2020_06_29","Week end 29/06/2020",2020-06-23 00:00:00.000,2020-06-29 23:59:59.000,"Rolling week","Weekly"
"rollingweek_2020_06_30","Week end 30/06/2020",2020-06-24 00:00:00.000,2020-06-30 23:59:59.000,"Rolling week","Weekly"
"rollingweek_2020_07_01","Week end 01/07/2020",2020-06-25 00:00:00.000,2020-07-01 23:59:59.000,"Rolling week","Weekly"
"rollingweek_2020_07_02","Week end 02/07/2020",2020-06-26 00:00:00.000,2020-07-02 23:59:59.000,"Rolling week","Weekly"
"rollingweek_2020_07_03","Week end 03/07/2020",2020-06-27 00:00:00.000,2020-07-03 23:59:59.000,"Rolling week","Weekly"
"rollingweek_2020_07_04","Week end 04/07/2020",2020-06-28 00:00:00.000,2020-07-04 23:59:59.000,"Rolling week","Weekly"
"rollingweek_2020_07_05","Week end 05/07/2020",2020-06-29 00:00:00.000,2020-07-05 23:59:59.000,"Rolling week","Weekly"
"rollingweek_2020_07_06","Week end 06/07/2020",2020-06-30 00:00:00.000,2020-07-06 23:59:59.000,"Rolling week","Weekly"
"rollingweek_2020_07_07","Week end 07/07/2020",2020-07-01 00:00:00.000,2020-07-07 23:59:59.000,"Rolling week","Weekly"
"rollingweek_2020_07_08","Week end 08/07/2020",2020-07-02 00:00:00.000,2020-07-08 23:59:59.000,"Rolling week","Weekly"
"rollingweek_2020_07_09","Week end 09/07/2020",2020-07-03 00:00:00.000,2020-07-09 23:59:59.000,"Rolling week","Weekly"
"rollingweek_2020_07_10","Week end 10/07/2020",2020-07-04 00:00:00.000,2020-07-10 23:59:59.000,"Rolling week","Weekly"
"rollingweek_2020_07_11","Week end 11/07/2020",2020-07-05 00:00:00.000,2020-07-11 23:59:59.000,"Rolling week","Weekly"
"rollingweek_2020_07_12","Week end 12/07/2020",2020-07-06 00:00:00.000,2020-07-12 23:59:59.000,"Rolling week","Weekly"
"rollingweek_2020_07_13","Week end 13/07/2020",2020-07-07 00:00:00.000,2020-07-13 23:59:59.000,"Rolling week","Weekly"
"rollingweek_2020_07_14","Week end 14/07/2020",2020-07-08 00:00:00.000,2020-07-14 23:59:59.000,"Rolling week","Weekly"
"rollingweek_2020_07_15","Week end 15/07/2020",2020-07-09 00:00:00.000,2020-07-15 23:59:59.000,"Rolling week","Weekly"
"rollingweek_2020_07_16","Week end 16/07/2020",2020-07-10 00:00:00.000,2020-07-16 23:59:59.000,"Rolling week","Weekly"
"rollingweek_2020_07_17","Week end 17/07/2020",2020-07-11 00:00:00.000,2020-07-17 23:59:59.000,"Rolling week","Weekly"
"rollingweek_2020_07_18","Week end 18/07/2020",2020-07-12 00:00:00.000,2020-07-18 23:59:59.000,"Rolling week","Weekly"
"rollingweek_2020_07_19","Week end 19/07/2020",2020-07-13 00:00:00.000,2020-07-19 23:59:59.000,"Rolling week","Weekly"
"rollingweek_2020_07_20","Week end 20/07/2020",2020-07-14 00:00:00.000,2020-07-20 23:59:59.000,"Rolling week","Weekly"
"rollingweek_2020_07_21","Week end 21/07/2020",2020-07-15 00:00:00.000,2020-07-21 23:59:59.000,"Rolling week","Weekly"
"rollingweek_2020_07_22","Week end 22/07/2020",2020-07-16 00:00:00.000,2020-07-22 23:59:59.000,"Rolling week","Weekly"
"rollingweek_2020_07_23","Week end 23/07/2020",2020-07-17 00:00:00.000,2020-07-23 23:59:59.000,"Rolling week","Weekly"
"rollingweek_2020_07_24","Week end 24/07/2020",2020-07-18 00:00:00.000,2020-07-24 23:59:59.000,"Rolling week","Weekly"
"rollingweek_2020_07_25","Week end 25/07/2020",2020-07-19 00:00:00.000,2020-07-25 23:59:59.000,"Rolling week","Weekly"
"rollingweek_2020_07_26","Week end 26/07/2020",2020-07-20 00:00:00.000,2020-07-26 23:59:59.000,"Rolling week","Weekly"
"rollingweek_2020_07_27","Week end 27/07/2020",2020-07-21 00:00:00.000,2020-07-27 23:59:59.000,"Rolling week","Weekly"
"rollingweek_2020_07_28","Week end 28/07/2020",2020-07-22 00:00:00.000,2020-07-28 23:59:59.000,"Rolling week","Weekly"
"rollingweek_2020_07_29","Week end 29/07/2020",2020-07-23 00:00:00.000,2020-07-29 23:59:59.000,"Rolling week","Weekly"
"rollingweek_2020_07_30","Week end 30/07/2020",2020-07-24 00:00:00.000,2020-07-30 23:59:59.000,"Rolling week","Weekly"
"rollingweek_2020_07_31","Week end 31/07/2020",2020-07-25 00:00:00.000,2020-07-31 23:59:59.000,"Rolling week","Weekly"
"rollingweek_2020_08_01","Week end 01/08/2020",2020-07-26 00:00:00.000,2020-08-01 23:59:59.000,"Rolling week","Weekly"
"rollingweek_2020_08_02","Week end 02/08/2020",2020-07-27 00:00:00.000,2020-08-02 23:59:59.000,"Rolling week","Weekly"
"rollingweek_2020_08_03","Week end 03/08/2020",2020-07-28 00:00:00.000,2020-08-03 23:59:59.000,"Rolling week","Weekly"
"rollingweek_2020_08_04","Week end 04/08/2020",2020-07-29 00:00:00.000,2020-08-04 23:59:59.000,"Rolling week","Weekly"
"rollingweek_2020_08_05","Week end 05/08/2020",2020-07-30 00:00:00.000,2020-08-05 23:59:59.000,"Rolling week","Weekly"
"rollingweek_2020_08_06","Week end 06/08/2020",2020-07-31 00:00:00.000,2020-08-06 23:59:59.000,"Rolling week","Weekly"
"rollingweek_2020_08_07","Week end 07/08/2020",2020-08-01 00:00:00.000,2020-08-07 23:59:59.000,"Rolling week","Weekly"
"rollingweek_2020_08_08","Week end 08/08/2020",2020-08-02 00:00:00.000,2020-08-08 23:59:59.000,"Rolling week","Weekly"
"rollingweek_2020_08_09","Week end 09/08/2020",2020-08-03 00:00:00.000,2020-08-09 23:59:59.000,"Rolling week","Weekly"
"rollingweek_2020_08_10","Week end 10/08/2020",2020-08-04 00:00:00.000,2020-08-10 23:59:59.000,"Rolling week","Weekly"
"rollingweek_2020_08_11","Week end 11/08/2020",2020-08-05 00:00:00.000,2020-08-11 23:59:59.000,"Rolling week","Weekly"
"rollingweek_2020_08_12","Week end 12/08/2020",2020-08-06 00:00:00.000,2020-08-12 23:59:59.000,"Rolling week","Weekly"
"rollingweek_2020_08_13","Week end 13/08/2020",2020-08-07 00:00:00.000,2020-08-13 23:59:59.000,"Rolling week","Weekly"
"rollingweek_2020_08_14","Week end 14/08/2020",2020-08-08 00:00:00.000,2020-08-14 23:59:59.000,"Rolling week","Weekly"
"rollingweek_2020_08_15","Week end 15/08/2020",2020-08-09 00:00:00.000,2020-08-15 23:59:59.000,"Rolling week","Weekly"
"rollingweek_2020_08_16","Week end 16/08/2020",2020-08-10 00:00:00.000,2020-08-16 23:59:59.000,"Rolling week","Weekly"
"rollingweek_2020_08_17","Week end 17/08/2020",2020-08-11 00:00:00.000,2020-08-17 23:59:59.000,"Rolling week","Weekly"
"rollingweek_2020_08_18","Week end 18/08/2020",2020-08-12 00:00:00.000,2020-08-18 23:59:59.000,"Rolling week","Weekly"
"rollingweek_2020_08_19","Week end 19/08/2020",2020-08-13 00:00:00.000,2020-08-19 23:59:59.000,"Rolling week","Weekly"
"rollingweek_2020_08_20","Week end 20/08/2020",2020-08-14 00:00:00.000,2020-08-20 23:59:59.000,"Rolling week","Weekly"
"rollingweek_2020_08_21","Week end 21/08/2020",2020-08-15 00:00:00.000,2020-08-21 23:59:59.000,"Rolling week","Weekly"
"rollingweek_2020_08_22","Week end 22/08/2020",2020-08-16 00:00:00.000,2020-08-22 23:59:59.000,"Rolling week","Weekly"
"rollingweek_2020_08_23","Week end 23/08/2020",2020-08-17 00:00:00.000,2020-08-23 23:59:59.000,"Rolling week","Weekly"
"rollingweek_2020_08_24","Week end 24/08/2020",2020-08-18 00:00:00.000,2020-08-24 23:59:59.000,"Rolling week","Weekly"
"rollingweek_2020_08_25","Week end 25/08/2020",2020-08-19 00:00:00.000,2020-08-25 23:59:59.000,"Rolling week","Weekly"
"rollingweek_2020_08_26","Week end 26/08/2020",2020-08-20 00:00:00.000,2020-08-26 23:59:59.000,"Rolling week","Weekly"
"rollingweek_2020_08_27","Week end 27/08/2020",2020-08-21 00:00:00.000,2020-08-27 23:59:59.000,"Rolling week","Weekly"
"rollingweek_2020_08_28","Week end 28/08/2020",2020-08-22 00:00:00.000,2020-08-28 23:59:59.000,"Rolling week","Weekly"
"rollingweek_2020_08_29","Week end 29/08/2020",2020-08-23 00:00:00.000,2020-08-29 23:59:59.000,"Rolling week","Weekly"
"rollingweek_2020_08_30","Week end 30/08/2020",2020-08-24 00:00:00.000,2020-08-30 23:59:59.000,"Rolling week","Weekly"
"rollingweek_2020_08_31","Week end 31/08/2020",2020-08-25 00:00:00.000,2020-08-31 23:59:59.000,"Rolling week","Weekly"
"rollingweek_2020_09_01","Week end 01/09/2020",2020-08-26 00:00:00.000,2020-09-01 23:59:59.000,"Rolling week","Weekly"
"rollingweek_2020_09_02","Week end 02/09/2020",2020-08-27 00:00:00.000,2020-09-02 23:59:59.000,"Rolling week","Weekly"
"rollingweek_2020_09_03","Week end 03/09/2020",2020-08-28 00:00:00.000,2020-09-03 23:59:59.000,"Rolling week","Weekly"
"rollingweek_2020_09_04","Week end 04/09/2020",2020-08-29 00:00:00.000,2020-09-04 23:59:59.000,"Rolling week","Weekly"
"rollingweek_2020_09_05","Week end 05/09/2020",2020-08-30 00:00:00.000,2020-09-05 23:59:59.000,"Rolling week","Weekly"
"rollingweek_2020_09_06","Week end 06/09/2020",2020-08-31 00:00:00.000,2020-09-06 23:59:59.000,"Rolling week","Weekly"
"rollingweek_2020_09_07","Week end 07/09/2020",2020-09-01 00:00:00.000,2020-09-07 23:59:59.000,"Rolling week","Weekly"
"rollingweek_2020_09_08","Week end 08/09/2020",2020-09-02 00:00:00.000,2020-09-08 23:59:59.000,"Rolling week","Weekly"
"rollingweek_2020_09_09","Week end 09/09/2020",2020-09-03 00:00:00.000,2020-09-09 23:59:59.000,"Rolling week","Weekly"
"rollingweek_2020_09_10","Week end 10/09/2020",2020-09-04 00:00:00.000,2020-09-10 23:59:59.000,"Rolling week","Weekly"
"rollingweek_2020_09_11","Week end 11/09/2020",2020-09-05 00:00:00.000,2020-09-11 23:59:59.000,"Rolling week","Weekly"
"rollingweek_2020_09_12","Week end 12/09/2020",2020-09-06 00:00:00.000,2020-09-12 23:59:59.000,"Rolling week","Weekly"
"rollingweek_2020_09_13","Week end 13/09/2020",2020-09-07 00:00:00.000,2020-09-13 23:59:59.000,"Rolling week","Weekly"
"rollingweek_2020_09_14","Week end 14/09/2020",2020-09-08 00:00:00.000,2020-09-14 23:59:59.000,"Rolling week","Weekly"
"rollingweek_2020_09_15","Week end 15/09/2020",2020-09-09 00:00:00.000,2020-09-15 23:59:59.000,"Rolling week","Weekly"
"rollingweek_2020_09_16","Week end 16/09/2020",2020-09-10 00:00:00.000,2020-09-16 23:59:59.000,"Rolling week","Weekly"
"rollingweek_2020_09_17","Week end 17/09/2020",2020-09-11 00:00:00.000,2020-09-17 23:59:59.000,"Rolling week","Weekly"
"rollingweek_2020_09_18","Week end 18/09/2020",2020-09-12 00:00:00.000,2020-09-18 23:59:59.000,"Rolling week","Weekly"
"rollingweek_2020_09_19","Week end 19/09/2020",2020-09-13 00:00:00.000,2020-09-19 23:59:59.000,"Rolling week","Weekly"
"rollingweek_2020_09_20","Week end 20/09/2020",2020-09-14 00:00:00.000,2020-09-20 23:59:59.000,"Rolling week","Weekly"
"rollingweek_2020_09_21","Week end 21/09/2020",2020-09-15 00:00:00.000,2020-09-21 23:59:59.000,"Rolling week","Weekly"
"rollingweek_2020_09_22","Week end 22/09/2020",2020-09-16 00:00:00.000,2020-09-22 23:59:59.000,"Rolling week","Weekly"
"rollingweek_2020_09_23","Week end 23/09/2020",2020-09-17 00:00:00.000,2020-09-23 23:59:59.000,"Rolling week","Weekly"
"rollingweek_2020_09_24","Week end 24/09/2020",2020-09-18 00:00:00.000,2020-09-24 23:59:59.000,"Rolling week","Weekly"
"rollingweek_2020_09_25","Week end 25/09/2020",2020-09-19 00:00:00.000,2020-09-25 23:59:59.000,"Rolling week","Weekly"
"rollingweek_2020_09_26","Week end 26/09/2020",2020-09-20 00:00:00.000,2020-09-26 23:59:59.000,"Rolling week","Weekly"
"rollingweek_2020_09_27","Week end 27/09/2020",2020-09-21 00:00:00.000,2020-09-27 23:59:59.000,"Rolling week","Weekly"
"rollingweek_2020_09_28","Week end 28/09/2020",2020-09-22 00:00:00.000,2020-09-28 23:59:59.000,"Rolling week","Weekly"
"rollingweek_2020_09_29","Week end 29/09/2020",2020-09-23 00:00:00.000,2020-09-29 23:59:59.000,"Rolling week","Weekly"
"rollingweek_2020_09_30","Week end 30/09/2020",2020-09-24 00:00:00.000,2020-09-30 23:59:59.000,"Rolling week","Weekly"
"rollingweek_2020_10_01","Week end 01/10/2020",2020-09-25 00:00:00.000,2020-10-01 23:59:59.000,"Rolling week","Weekly"
"rollingweek_2020_10_02","Week end 02/10/2020",2020-09-26 00:00:00.000,2020-10-02 23:59:59.000,"Rolling week","Weekly"
"rollingweek_2020_10_03","Week end 03/10/2020",2020-09-27 00:00:00.000,2020-10-03 23:59:59.000,"Rolling week","Weekly"
"rollingweek_2020_10_04","Week end 04/10/2020",2020-09-28 00:00:00.000,2020-10-04 23:59:59.000,"Rolling week","Weekly"
"rollingweek_2020_10_05","Week end 05/10/2020",2020-09-29 00:00:00.000,2020-10-05 23:59:59.000,"Rolling week","Weekly"
"rollingweek_2020_10_06","Week end 06/10/2020",2020-09-30 00:00:00.000,2020-10-06 23:59:59.000,"Rolling week","Weekly"
"rollingweek_2020_10_07","Week end 07/10/2020",2020-10-01 00:00:00.000,2020-10-07 23:59:59.000,"Rolling week","Weekly"
"rollingweek_2020_10_08","Week end 08/10/2020",2020-10-02 00:00:00.000,2020-10-08 23:59:59.000,"Rolling week","Weekly"
"rollingweek_2020_10_09","Week end 09/10/2020",2020-10-03 00:00:00.000,2020-10-09 23:59:59.000,"Rolling week","Weekly"
"rollingweek_2020_10_10","Week end 10/10/2020",2020-10-04 00:00:00.000,2020-10-10 23:59:59.000,"Rolling week","Weekly"
"rollingweek_2020_10_11","Week end 11/10/2020",2020-10-05 00:00:00.000,2020-10-11 23:59:59.000,"Rolling week","Weekly"
"rollingweek_2020_10_12","Week end 12/10/2020",2020-10-06 00:00:00.000,2020-10-12 23:59:59.000,"Rolling week","Weekly"
"rollingweek_2020_10_13","Week end 13/10/2020",2020-10-07 00:00:00.000,2020-10-13 23:59:59.000,"Rolling week","Weekly"
"rollingweek_2020_10_14","Week end 14/10/2020",2020-10-08 00:00:00.000,2020-10-14 23:59:59.000,"Rolling week","Weekly"
"rollingweek_2020_10_15","Week end 15/10/2020",2020-10-09 00:00:00.000,2020-10-15 23:59:59.000,"Rolling week","Weekly"
"rollingweek_2020_10_16","Week end 16/10/2020",2020-10-10 00:00:00.000,2020-10-16 23:59:59.000,"Rolling week","Weekly"
"rollingweek_2020_10_17","Week end 17/10/2020",2020-10-11 00:00:00.000,2020-10-17 23:59:59.000,"Rolling week","Weekly"
"rollingweek_2020_10_18","Week end 18/10/2020",2020-10-12 00:00:00.000,2020-10-18 23:59:59.000,"Rolling week","Weekly"
"rollingweek_2020_10_19","Week end 19/10/2020",2020-10-13 00:00:00.000,2020-10-19 23:59:59.000,"Rolling week","Weekly"
"rollingweek_2020_10_20","Week end 20/10/2020",2020-10-14 00:00:00.000,2020-10-20 23:59:59.000,"Rolling week","Weekly"
"rollingweek_2020_10_21","Week end 21/10/2020",2020-10-15 00:00:00.000,2020-10-21 23:59:59.000,"Rolling week","Weekly"
"rollingweek_2020_10_22","Week end 22/10/2020",2020-10-16 00:00:00.000,2020-10-22 23:59:59.000,"Rolling week","Weekly"
"rollingweek_2020_10_23","Week end 23/10/2020",2020-10-17 00:00:00.000,2020-10-23 23:59:59.000,"Rolling week","Weekly"
"rollingweek_2020_10_24","Week end 24/10/2020",2020-10-18 00:00:00.000,2020-10-24 23:59:59.000,"Rolling week","Weekly"
"rollingweek_2020_10_25","Week end 25/10/2020",2020-10-19 00:00:00.000,2020-10-25 23:59:59.000,"Rolling week","Weekly"
"rollingweek_2020_10_26","Week end 26/10/2020",2020-10-20 00:00:00.000,2020-10-26 23:59:59.000,"Rolling week","Weekly"
"rollingweek_2020_10_27","Week end 27/10/2020",2020-10-21 00:00:00.000,2020-10-27 23:59:59.000,"Rolling week","Weekly"
"rollingweek_2020_10_28","Week end 28/10/2020",2020-10-22 00:00:00.000,2020-10-28 23:59:59.000,"Rolling week","Weekly"
"rollingweek_2020_10_29","Week end 29/10/2020",2020-10-23 00:00:00.000,2020-10-29 23:59:59.000,"Rolling week","Weekly"
"rollingweek_2020_10_30","Week end 30/10/2020",2020-10-24 00:00:00.000,2020-10-30 23:59:59.000,"Rolling week","Weekly"
"rollingweek_2020_10_31","Week end 31/10/2020",2020-10-25 00:00:00.000,2020-10-31 23:59:59.000,"Rolling week","Weekly"
"rollingweek_2020_11_01","Week end 01/11/2020",2020-10-26 00:00:00.000,2020-11-01 23:59:59.000,"Rolling week","Weekly"
"rollingweek_2020_11_02","Week end 02/11/2020",2020-10-27 00:00:00.000,2020-11-02 23:59:59.000,"Rolling week","Weekly"
"rollingweek_2020_11_03","Week end 03/11/2020",2020-10-28 00:00:00.000,2020-11-03 23:59:59.000,"Rolling week","Weekly"
"rollingweek_2020_11_04","Week end 04/11/2020",2020-10-29 00:00:00.000,2020-11-04 23:59:59.000,"Rolling week","Weekly"
"rollingweek_2020_11_05","Week end 05/11/2020",2020-10-30 00:00:00.000,2020-11-05 23:59:59.000,"Rolling week","Weekly"
"rollingweek_2020_11_06","Week end 06/11/2020",2020-10-31 00:00:00.000,2020-11-06 23:59:59.000,"Rolling week","Weekly"
"rollingweek_2020_11_07","Week end 07/11/2020",2020-11-01 00:00:00.000,2020-11-07 23:59:59.000,"Rolling week","Weekly"
"rollingweek_2020_11_08","Week end 08/11/2020",2020-11-02 00:00:00.000,2020-11-08 23:59:59.000,"Rolling week","Weekly"
"rollingweek_2020_11_09","Week end 09/11/2020",2020-11-03 00:00:00.000,2020-11-09 23:59:59.000,"Rolling week","Weekly"
"rollingweek_2020_11_10","Week end 10/11/2020",2020-11-04 00:00:00.000,2020-11-10 23:59:59.000,"Rolling week","Weekly"
"rollingweek_2020_11_11","Week end 11/11/2020",2020-11-05 00:00:00.000,2020-11-11 23:59:59.000,"Rolling week","Weekly"
"rollingweek_2020_11_12","Week end 12/11/2020",2020-11-06 00:00:00.000,2020-11-12 23:59:59.000,"Rolling week","Weekly"
"rollingweek_2020_11_13","Week end 13/11/2020",2020-11-07 00:00:00.000,2020-11-13 23:59:59.000,"Rolling week","Weekly"
"rollingweek_2020_11_14","Week end 14/11/2020",2020-11-08 00:00:00.000,2020-11-14 23:59:59.000,"Rolling week","Weekly"
"rollingweek_2020_11_15","Week end 15/11/2020",2020-11-09 00:00:00.000,2020-11-15 23:59:59.000,"Rolling week","Weekly"
"rollingweek_2020_11_16","Week end 16/11/2020",2020-11-10 00:00:00.000,2020-11-16 23:59:59.000,"Rolling week","Weekly"
"rollingweek_2020_11_17","Week end 17/11/2020",2020-11-11 00:00:00.000,2020-11-17 23:59:59.000,"Rolling week","Weekly"
"rollingweek_2020_11_18","Week end 18/11/2020",2020-11-12 00:00:00.000,2020-11-18 23:59:59.000,"Rolling week","Weekly"
"rollingweek_2020_11_19","Week end 19/11/2020",2020-11-13 00:00:00.000,2020-11-19 23:59:59.000,"Rolling week","Weekly"
"rollingweek_2020_11_20","Week end 20/11/2020",2020-11-14 00:00:00.000,2020-11-20 23:59:59.000,"Rolling week","Weekly"
"rollingweek_2020_11_21","Week end 21/11/2020",2020-11-15 00:00:00.000,2020-11-21 23:59:59.000,"Rolling week","Weekly"
"rollingweek_2020_11_22","Week end 22/11/2020",2020-11-16 00:00:00.000,2020-11-22 23:59:59.000,"Rolling week","Weekly"
"rollingweek_2020_11_23","Week end 23/11/2020",2020-11-17 00:00:00.000,2020-11-23 23:59:59.000,"Rolling week","Weekly"
"rollingweek_2020_11_24","Week end 24/11/2020",2020-11-18 00:00:00.000,2020-11-24 23:59:59.000,"Rolling week","Weekly"
"rollingweek_2020_11_25","Week end 25/11/2020",2020-11-19 00:00:00.000,2020-11-25 23:59:59.000,"Rolling week","Weekly"
"rollingweek_2020_11_26","Week end 26/11/2020",2020-11-20 00:00:00.000,2020-11-26 23:59:59.000,"Rolling week","Weekly"
"rollingweek_2020_11_27","Week end 27/11/2020",2020-11-21 00:00:00.000,2020-11-27 23:59:59.000,"Rolling week","Weekly"
"rollingweek_2020_11_28","Week end 28/11/2020",2020-11-22 00:00:00.000,2020-11-28 23:59:59.000,"Rolling week","Weekly"
"rollingweek_2020_11_29","Week end 29/11/2020",2020-11-23 00:00:00.000,2020-11-29 23:59:59.000,"Rolling week","Weekly"
"rollingweek_2020_11_30","Week end 30/11/2020",2020-11-24 00:00:00.000,2020-11-30 23:59:59.000,"Rolling week","Weekly"
"rollingweek_2020_12_01","Week end 01/12/2020",2020-11-25 00:00:00.000,2020-12-01 23:59:59.000,"Rolling week","Weekly"
"rollingweek_2020_12_02","Week end 02/12/2020",2020-11-26 00:00:00.000,2020-12-02 23:59:59.000,"Rolling week","Weekly"
"rollingweek_2020_12_03","Week end 03/12/2020",2020-11-27 00:00:00.000,2020-12-03 23:59:59.000,"Rolling week","Weekly"
"rollingweek_2020_12_04","Week end 04/12/2020",2020-11-28 00:00:00.000,2020-12-04 23:59:59.000,"Rolling week","Weekly"
"rollingweek_2020_12_05","Week end 05/12/2020",2020-11-29 00:00:00.000,2020-12-05 23:59:59.000,"Rolling week","Weekly"
"rollingweek_2020_12_06","Week end 06/12/2020",2020-11-30 00:00:00.000,2020-12-06 23:59:59.000,"Rolling week","Weekly"
"rollingweek_2020_12_07","Week end 07/12/2020",2020-12-01 00:00:00.000,2020-12-07 23:59:59.000,"Rolling week","Weekly"
"rollingweek_2020_12_08","Week end 08/12/2020",2020-12-02 00:00:00.000,2020-12-08 23:59:59.000,"Rolling week","Weekly"
"rollingweek_2020_12_09","Week end 09/12/2020",2020-12-03 00:00:00.000,2020-12-09 23:59:59.000,"Rolling week","Weekly"
"rollingweek_2020_12_10","Week end 10/12/2020",2020-12-04 00:00:00.000,2020-12-10 23:59:59.000,"Rolling week","Weekly"
"rollingweek_2020_12_11","Week end 11/12/2020",2020-12-05 00:00:00.000,2020-12-11 23:59:59.000,"Rolling week","Weekly"
"rollingweek_2020_12_12","Week end 12/12/2020",2020-12-06 00:00:00.000,2020-12-12 23:59:59.000,"Rolling week","Weekly"
"rollingweek_2020_12_13","Week end 13/12/2020",2020-12-07 00:00:00.000,2020-12-13 23:59:59.000,"Rolling week","Weekly"
"rollingweek_2020_12_14","Week end 14/12/2020",2020-12-08 00:00:00.000,2020-12-14 23:59:59.000,"Rolling week","Weekly"
"rollingweek_2020_12_15","Week end 15/12/2020",2020-12-09 00:00:00.000,2020-12-15 23:59:59.000,"Rolling week","Weekly"
"rollingweek_2020_12_16","Week end 16/12/2020",2020-12-10 00:00:00.000,2020-12-16 23:59:59.000,"Rolling week","Weekly"
"rollingweek_2020_12_17","Week end 17/12/2020",2020-12-11 00:00:00.000,2020-12-17 23:59:59.000,"Rolling week","Weekly"
"rollingweek_2020_12_18","Week end 18/12/2020",2020-12-12 00:00:00.000,2020-12-18 23:59:59.000,"Rolling week","Weekly"
"rollingweek_2020_12_19","Week end 19/12/2020",2020-12-13 00:00:00.000,2020-12-19 23:59:59.000,"Rolling week","Weekly"
"rollingweek_2020_12_20","Week end 20/12/2020",2020-12-14 00:00:00.000,2020-12-20 23:59:59.000,"Rolling week","Weekly"
"rollingweek_2020_12_21","Week end 21/12/2020",2020-12-15 00:00:00.000,2020-12-21 23:59:59.000,"Rolling week","Weekly"
"rollingweek_2020_12_22","Week end 22/12/2020",2020-12-16 00:00:00.000,2020-12-22 23:59:59.000,"Rolling week","Weekly"
"rollingweek_2020_12_23","Week end 23/12/2020",2020-12-17 00:00:00.000,2020-12-23 23:59:59.000,"Rolling week","Weekly"
"rollingweek_2020_12_24","Week end 24/12/2020",2020-12-18 00:00:00.000,2020-12-24 23:59:59.000,"Rolling week","Weekly"
"rollingweek_2020_12_25","Week end 25/12/2020",2020-12-19 00:00:00.000,2020-12-25 23:59:59.000,"Rolling week","Weekly"
"rollingweek_2020_12_26","Week end 26/12/2020",2020-12-20 00:00:00.000,2020-12-26 23:59:59.000,"Rolling week","Weekly"
"rollingweek_2020_12_27","Week end 27/12/2020",2020-12-21 00:00:00.000,2020-12-27 23:59:59.000,"Rolling week","Weekly"
"rollingweek_2020_12_28","Week end 28/12/2020",2020-12-22 00:00:00.000,2020-12-28 23:59:59.000,"Rolling week","Weekly"
"rollingweek_2020_12_29","Week end 29/12/2020",2020-12-23 00:00:00.000,2020-12-29 23:59:59.000,"Rolling week","Weekly"
"rollingweek_2020_12_30","Week end 30/12/2020",2020-12-24 00:00:00.000,2020-12-30 23:59:59.000,"Rolling week","Weekly"
"rollingweek_2020_12_31","Week end 31/12/2020",2020-12-25 00:00:00.000,2020-12-31 23:59:59.000,"Rolling week","Weekly"
"rollingweek_2021_01_01","Week end 01/01/2021",2020-12-26 00:00:00.000,2021-01-01 23:59:59.000,"Rolling week","Weekly"
"rollingweek_2021_01_02","Week end 02/01/2021",2020-12-27 00:00:00.000,2021-01-02 23:59:59.000,"Rolling week","Weekly"
"rollingweek_2021_01_03","Week end 03/01/2021",2020-12-28 00:00:00.000,2021-01-03 23:59:59.000,"Rolling week","Weekly"
"rollingweek_2021_01_04","Week end 04/01/2021",2020-12-29 00:00:00.000,2021-01-04 23:59:59.000,"Rolling week","Weekly"
"rollingweek_2021_01_05","Week end 05/01/2021",2020-12-30 00:00:00.000,2021-01-05 23:59:59.000,"Rolling week","Weekly"
"rollingweek_2021_01_06","Week end 06/01/2021",2020-12-31 00:00:00.000,2021-01-06 23:59:59.000,"Rolling week","Weekly"
"rollingweek_2021_01_07","Week end 07/01/2021",2021-01-01 00:00:00.000,2021-01-07 23:59:59.000,"Rolling week","Weekly"
"rollingweek_2021_01_08","Week end 08/01/2021",2021-01-02 00:00:00.000,2021-01-08 23:59:59.000,"Rolling week","Weekly"
"rollingweek_2021_01_09","Week end 09/01/2021",2021-01-03 00:00:00.000,2021-01-09 23:59:59.000,"Rolling week","Weekly"
"rollingweek_2021_01_10","Week end 10/01/2021",2021-01-04 00:00:00.000,2021-01-10 23:59:59.000,"Rolling week","Weekly"
"rollingweek_2021_01_11","Week end 11/01/2021",2021-01-05 00:00:00.000,2021-01-11 23:59:59.000,"Rolling week","Weekly"
"rollingweek_2021_01_12","Week end 12/01/2021",2021-01-06 00:00:00.000,2021-01-12 23:59:59.000,"Rolling week","Weekly"
"rollingweek_2021_01_13","Week end 13/01/2021",2021-01-07 00:00:00.000,2021-01-13 23:59:59.000,"Rolling week","Weekly"
"rollingweek_2021_01_14","Week end 14/01/2021",2021-01-08 00:00:00.000,2021-01-14 23:59:59.000,"Rolling week","Weekly"
"rollingweek_2021_01_15","Week end 15/01/2021",2021-01-09 00:00:00.000,2021-01-15 23:59:59.000,"Rolling week","Weekly"
"rollingweek_2021_01_16","Week end 16/01/2021",2021-01-10 00:00:00.000,2021-01-16 23:59:59.000,"Rolling week","Weekly"
"rollingweek_2021_01_17","Week end 17/01/2021",2021-01-11 00:00:00.000,2021-01-17 23:59:59.000,"Rolling week","Weekly"
"rollingweek_2021_01_18","Week end 18/01/2021",2021-01-12 00:00:00.000,2021-01-18 23:59:59.000,"Rolling week","Weekly"
"rollingweek_2021_01_19","Week end 19/01/2021",2021-01-13 00:00:00.000,2021-01-19 23:59:59.000,"Rolling week","Weekly"
"rollingweek_2021_01_20","Week end 20/01/2021",2021-01-14 00:00:00.000,2021-01-20 23:59:59.000,"Rolling week","Weekly"
"rollingweek_2021_01_21","Week end 21/01/2021",2021-01-15 00:00:00.000,2021-01-21 23:59:59.000,"Rolling week","Weekly"
"rollingweek_2021_01_22","Week end 22/01/2021",2021-01-16 00:00:00.000,2021-01-22 23:59:59.000,"Rolling week","Weekly"
"rollingweek_2021_01_23","Week end 23/01/2021",2021-01-17 00:00:00.000,2021-01-23 23:59:59.000,"Rolling week","Weekly"
"rollingweek_2021_01_24","Week end 24/01/2021",2021-01-18 00:00:00.000,2021-01-24 23:59:59.000,"Rolling week","Weekly"
"rollingweek_2021_01_25","Week end 25/01/2021",2021-01-19 00:00:00.000,2021-01-25 23:59:59.000,"Rolling week","Weekly"
"rollingweek_2021_01_26","Week end 26/01/2021",2021-01-20 00:00:00.000,2021-01-26 23:59:59.000,"Rolling week","Weekly"
"rollingweek_2021_01_27","Week end 27/01/2021",2021-01-21 00:00:00.000,2021-01-27 23:59:59.000,"Rolling week","Weekly"
"rollingweek_2021_01_28","Week end 28/01/2021",2021-01-22 00:00:00.000,2021-01-28 23:59:59.000,"Rolling week","Weekly"
"rollingweek_2021_01_29","Week end 29/01/2021",2021-01-23 00:00:00.000,2021-01-29 23:59:59.000,"Rolling week","Weekly"
"rollingweek_2021_01_30","Week end 30/01/2021",2021-01-24 00:00:00.000,2021-01-30 23:59:59.000,"Rolling week","Weekly"
"rollingweek_2021_01_31","Week end 31/01/2021",2021-01-25 00:00:00.000,2021-01-31 23:59:59.000,"Rolling week","Weekly"
"rollingweek_2021_02_01","Week end 01/02/2021",2021-01-26 00:00:00.000,2021-02-01 23:59:59.000,"Rolling week","Weekly"
"rollingweek_2021_02_02","Week end 02/02/2021",2021-01-27 00:00:00.000,2021-02-02 23:59:59.000,"Rolling week","Weekly"
"rollingweek_2021_02_03","Week end 03/02/2021",2021-01-28 00:00:00.000,2021-02-03 23:59:59.000,"Rolling week","Weekly"
"rollingweek_2021_02_04","Week end 04/02/2021",2021-01-29 00:00:00.000,2021-02-04 23:59:59.000,"Rolling week","Weekly"
"rollingweek_2021_02_05","Week end 05/02/2021",2021-01-30 00:00:00.000,2021-02-05 23:59:59.000,"Rolling week","Weekly"
"rollingweek_2021_02_06","Week end 06/02/2021",2021-01-31 00:00:00.000,2021-02-06 23:59:59.000,"Rolling week","Weekly"
"rollingweek_2021_02_07","Week end 07/02/2021",2021-02-01 00:00:00.000,2021-02-07 23:59:59.000,"Rolling week","Weekly"
"rollingweek_2021_02_08","Week end 08/02/2021",2021-02-02 00:00:00.000,2021-02-08 23:59:59.000,"Rolling week","Weekly"
"rollingweek_2021_02_09","Week end 09/02/2021",2021-02-03 00:00:00.000,2021-02-09 23:59:59.000,"Rolling week","Weekly"
"rollingweek_2021_02_10","Week end 10/02/2021",2021-02-04 00:00:00.000,2021-02-10 23:59:59.000,"Rolling week","Weekly"
"rollingweek_2021_02_11","Week end 11/02/2021",2021-02-05 00:00:00.000,2021-02-11 23:59:59.000,"Rolling week","Weekly"
"rollingweek_2021_02_12","Week end 12/02/2021",2021-02-06 00:00:00.000,2021-02-12 23:59:59.000,"Rolling week","Weekly"
"rollingweek_2021_02_13","Week end 13/02/2021",2021-02-07 00:00:00.000,2021-02-13 23:59:59.000,"Rolling week","Weekly"
"rollingweek_2021_02_14","Week end 14/02/2021",2021-02-08 00:00:00.000,2021-02-14 23:59:59.000,"Rolling week","Weekly"
"rollingweek_2021_02_15","Week end 15/02/2021",2021-02-09 00:00:00.000,2021-02-15 23:59:59.000,"Rolling week","Weekly"
"rollingweek_2021_02_16","Week end 16/02/2021",2021-02-10 00:00:00.000,2021-02-16 23:59:59.000,"Rolling week","Weekly"
"rollingweek_2021_02_17","Week end 17/02/2021",2021-02-11 00:00:00.000,2021-02-17 23:59:59.000,"Rolling week","Weekly"
"rollingweek_2021_02_18","Week end 18/02/2021",2021-02-12 00:00:00.000,2021-02-18 23:59:59.000,"Rolling week","Weekly"
"rollingweek_2021_02_19","Week end 19/02/2021",2021-02-13 00:00:00.000,2021-02-19 23:59:59.000,"Rolling week","Weekly"
"rollingweek_2021_02_20","Week end 20/02/2021",2021-02-14 00:00:00.000,2021-02-20 23:59:59.000,"Rolling week","Weekly"
"rollingweek_2021_02_21","Week end 21/02/2021",2021-02-15 00:00:00.000,2021-02-21 23:59:59.000,"Rolling week","Weekly"
"rollingweek_2021_02_22","Week end 22/02/2021",2021-02-16 00:00:00.000,2021-02-22 23:59:59.000,"Rolling week","Weekly"
"rollingweek_2021_02_23","Week end 23/02/2021",2021-02-17 00:00:00.000,2021-02-23 23:59:59.000,"Rolling week","Weekly"
"rollingweek_2021_02_24","Week end 24/02/2021",2021-02-18 00:00:00.000,2021-02-24 23:59:59.000,"Rolling week","Weekly"
"rollingweek_2021_02_25","Week end 25/02/2021",2021-02-19 00:00:00.000,2021-02-25 23:59:59.000,"Rolling week","Weekly"
"rollingweek_2021_02_26","Week end 26/02/2021",2021-02-20 00:00:00.000,2021-02-26 23:59:59.000,"Rolling week","Weekly"
"rollingweek_2021_02_27","Week end 27/02/2021",2021-02-21 00:00:00.000,2021-02-27 23:59:59.000,"Rolling week","Weekly"
"rollingweek_2021_02_28","Week end 28/02/2021",2021-02-22 00:00:00.000,2021-02-28 23:59:59.000,"Rolling week","Weekly"
"rollingweek_2021_03_01","Week end 01/03/2021",2021-02-23 00:00:00.000,2021-03-01 23:59:59.000,"Rolling week","Weekly"
"rollingweek_2021_03_02","Week end 02/03/2021",2021-02-24 00:00:00.000,2021-03-02 23:59:59.000,"Rolling week","Weekly"
"rollingweek_2021_03_03","Week end 03/03/2021",2021-02-25 00:00:00.000,2021-03-03 23:59:59.000,"Rolling week","Weekly"
"rollingweek_2021_03_04","Week end 04/03/2021",2021-02-26 00:00:00.000,2021-03-04 23:59:59.000,"Rolling week","Weekly"
"rollingweek_2021_03_05","Week end 05/03/2021",2021-02-27 00:00:00.000,2021-03-05 23:59:59.000,"Rolling week","Weekly"
"rollingweek_2021_03_06","Week end 06/03/2021",2021-02-28 00:00:00.000,2021-03-06 23:59:59.000,"Rolling week","Weekly"
"rollingweek_2021_03_07","Week end 07/03/2021",2021-03-01 00:00:00.000,2021-03-07 23:59:59.000,"Rolling week","Weekly"
"rollingweek_2021_03_08","Week end 08/03/2021",2021-03-02 00:00:00.000,2021-03-08 23:59:59.000,"Rolling week","Weekly"
"rollingweek_2021_03_09","Week end 09/03/2021",2021-03-03 00:00:00.000,2021-03-09 23:59:59.000,"Rolling week","Weekly"
"rollingweek_2021_03_10","Week end 10/03/2021",2021-03-04 00:00:00.000,2021-03-10 23:59:59.000,"Rolling week","Weekly"
"rollingweek_2021_03_11","Week end 11/03/2021",2021-03-05 00:00:00.000,2021-03-11 23:59:59.000,"Rolling week","Weekly"
"rollingweek_2021_03_12","Week end 12/03/2021",2021-03-06 00:00:00.000,2021-03-12 23:59:59.000,"Rolling week","Weekly"
"rollingweek_2021_03_13","Week end 13/03/2021",2021-03-07 00:00:00.000,2021-03-13 23:59:59.000,"Rolling week","Weekly"
"rollingweek_2021_03_14","Week end 14/03/2021",2021-03-08 00:00:00.000,2021-03-14 23:59:59.000,"Rolling week","Weekly"
"rollingweek_2021_03_15","Week end 15/03/2021",2021-03-09 00:00:00.000,2021-03-15 23:59:59.000,"Rolling week","Weekly"
"rollingweek_2021_03_16","Week end 16/03/2021",2021-03-10 00:00:00.000,2021-03-16 23:59:59.000,"Rolling week","Weekly"
"rollingweek_2021_03_17","Week end 17/03/2021",2021-03-11 00:00:00.000,2021-03-17 23:59:59.000,"Rolling week","Weekly"
"rollingweek_2021_03_18","Week end 18/03/2021",2021-03-12 00:00:00.000,2021-03-18 23:59:59.000,"Rolling week","Weekly"
"rollingweek_2021_03_19","Week end 19/03/2021",2021-03-13 00:00:00.000,2021-03-19 23:59:59.000,"Rolling week","Weekly"
"rollingweek_2021_03_20","Week end 20/03/2021",2021-03-14 00:00:00.000,2021-03-20 23:59:59.000,"Rolling week","Weekly"
"rollingweek_2021_03_21","Week end 21/03/2021",2021-03-15 00:00:00.000,2021-03-21 23:59:59.000,"Rolling week","Weekly"
"rollingweek_2021_03_22","Week end 22/03/2021",2021-03-16 00:00:00.000,2021-03-22 23:59:59.000,"Rolling week","Weekly"
"rollingweek_2021_03_23","Week end 23/03/2021",2021-03-17 00:00:00.000,2021-03-23 23:59:59.000,"Rolling week","Weekly"
"rollingweek_2021_03_24","Week end 24/03/2021",2021-03-18 00:00:00.000,2021-03-24 23:59:59.000,"Rolling week","Weekly"
"rollingweek_2021_03_25","Week end 25/03/2021",2021-03-19 00:00:00.000,2021-03-25 23:59:59.000,"Rolling week","Weekly"
"rollingweek_2021_03_26","Week end 26/03/2021",2021-03-20 00:00:00.000,2021-03-26 23:59:59.000,"Rolling week","Weekly"
"rollingweek_2021_03_27","Week end 27/03/2021",2021-03-21 00:00:00.000,2021-03-27 23:59:59.000,"Rolling week","Weekly"
"rollingweek_2021_03_28","Week end 28/03/2021",2021-03-22 00:00:00.000,2021-03-28 23:59:59.000,"Rolling week","Weekly"
"rollingweek_2021_03_29","Week end 29/03/2021",2021-03-23 00:00:00.000,2021-03-29 23:59:59.000,"Rolling week","Weekly"
"rollingweek_2021_03_30","Week end 30/03/2021",2021-03-24 00:00:00.000,2021-03-30 23:59:59.000,"Rolling week","Weekly"
"rollingweek_2021_03_31","Week end 31/03/2021",2021-03-25 00:00:00.000,2021-03-31 23:59:59.000,"Rolling week","Weekly"
"rollingweek_2021_04_01","Week end 01/04/2021",2021-03-26 00:00:00.000,2021-04-01 23:59:59.000,"Rolling week","Weekly"
"rollingweek_2021_04_02","Week end 02/04/2021",2021-03-27 00:00:00.000,2021-04-02 23:59:59.000,"Rolling week","Weekly"
"rollingweek_2021_04_03","Week end 03/04/2021",2021-03-28 00:00:00.000,2021-04-03 23:59:59.000,"Rolling week","Weekly"
"rollingweek_2021_04_04","Week end 04/04/2021",2021-03-29 00:00:00.000,2021-04-04 23:59:59.000,"Rolling week","Weekly"
"rollingweek_2021_04_05","Week end 05/04/2021",2021-03-30 00:00:00.000,2021-04-05 23:59:59.000,"Rolling week","Weekly"
"rollingweek_2021_04_06","Week end 06/04/2021",2021-03-31 00:00:00.000,2021-04-06 23:59:59.000,"Rolling week","Weekly"
"rollingweek_2021_04_07","Week end 07/04/2021",2021-04-01 00:00:00.000,2021-04-07 23:59:59.000,"Rolling week","Weekly"
"rollingweek_2021_04_08","Week end 08/04/2021",2021-04-02 00:00:00.000,2021-04-08 23:59:59.000,"Rolling week","Weekly"
"rollingweek_2021_04_09","Week end 09/04/2021",2021-04-03 00:00:00.000,2021-04-09 23:59:59.000,"Rolling week","Weekly"
"rollingweek_2021_04_10","Week end 10/04/2021",2021-04-04 00:00:00.000,2021-04-10 23:59:59.000,"Rolling week","Weekly"
"rollingweek_2021_04_11","Week end 11/04/2021",2021-04-05 00:00:00.000,2021-04-11 23:59:59.000,"Rolling week","Weekly"
"rollingweek_2021_04_12","Week end 12/04/2021",2021-04-06 00:00:00.000,2021-04-12 23:59:59.000,"Rolling week","Weekly"
"rollingweek_2021_04_13","Week end 13/04/2021",2021-04-07 00:00:00.000,2021-04-13 23:59:59.000,"Rolling week","Weekly"
"rollingweek_2021_04_14","Week end 14/04/2021",2021-04-08 00:00:00.000,2021-04-14 23:59:59.000,"Rolling week","Weekly"
"rollingweek_2021_04_15","Week end 15/04/2021",2021-04-09 00:00:00.000,2021-04-15 23:59:59.000,"Rolling week","Weekly"
"rollingweek_2021_04_16","Week end 16/04/2021",2021-04-10 00:00:00.000,2021-04-16 23:59:59.000,"Rolling week","Weekly"
"rollingweek_2021_04_17","Week end 17/04/2021",2021-04-11 00:00:00.000,2021-04-17 23:59:59.000,"Rolling week","Weekly"
"rollingweek_2021_04_18","Week end 18/04/2021",2021-04-12 00:00:00.000,2021-04-18 23:59:59.000,"Rolling week","Weekly"
"rollingweek_2021_04_19","Week end 19/04/2021",2021-04-13 00:00:00.000,2021-04-19 23:59:59.000,"Rolling week","Weekly"
"rollingweek_2021_04_20","Week end 20/04/2021",2021-04-14 00:00:00.000,2021-04-20 23:59:59.000,"Rolling week","Weekly"
"rollingweek_2021_04_21","Week end 21/04/2021",2021-04-15 00:00:00.000,2021-04-21 23:59:59.000,"Rolling week","Weekly"
"rollingweek_2021_04_22","Week end 22/04/2021",2021-04-16 00:00:00.000,2021-04-22 23:59:59.000,"Rolling week","Weekly"
"rollingweek_2021_04_23","Week end 23/04/2021",2021-04-17 00:00:00.000,2021-04-23 23:59:59.000,"Rolling week","Weekly"
"rollingweek_2021_04_24","Week end 24/04/2021",2021-04-18 00:00:00.000,2021-04-24 23:59:59.000,"Rolling week","Weekly"
"rollingweek_2021_04_25","Week end 25/04/2021",2021-04-19 00:00:00.000,2021-04-25 23:59:59.000,"Rolling week","Weekly"
"rollingweek_2021_04_26","Week end 26/04/2021",2021-04-20 00:00:00.000,2021-04-26 23:59:59.000,"Rolling week","Weekly"
"rollingweek_2021_04_27","Week end 27/04/2021",2021-04-21 00:00:00.000,2021-04-27 23:59:59.000,"Rolling week","Weekly"
"rollingweek_2021_04_28","Week end 28/04/2021",2021-04-22 00:00:00.000,2021-04-28 23:59:59.000,"Rolling week","Weekly"
"rollingweek_2021_04_29","Week end 29/04/2021",2021-04-23 00:00:00.000,2021-04-29 23:59:59.000,"Rolling week","Weekly"
"rollingweek_2021_04_30","Week end 30/04/2021",2021-04-24 00:00:00.000,2021-04-30 23:59:59.000,"Rolling week","Weekly"
"rollingweek_2021_05_01","Week end 01/05/2021",2021-04-25 00:00:00.000,2021-05-01 23:59:59.000,"Rolling week","Weekly"
"rollingweek_2021_05_02","Week end 02/05/2021",2021-04-26 00:00:00.000,2021-05-02 23:59:59.000,"Rolling week","Weekly"
"rollingweek_2021_05_03","Week end 03/05/2021",2021-04-27 00:00:00.000,2021-05-03 23:59:59.000,"Rolling week","Weekly"
"rollingweek_2021_05_04","Week end 04/05/2021",2021-04-28 00:00:00.000,2021-05-04 23:59:59.000,"Rolling week","Weekly"
"rollingweek_2021_05_05","Week end 05/05/2021",2021-04-29 00:00:00.000,2021-05-05 23:59:59.000,"Rolling week","Weekly"
"rollingweek_2021_05_06","Week end 06/05/2021",2021-04-30 00:00:00.000,2021-05-06 23:59:59.000,"Rolling week","Weekly"
"rollingweek_2021_05_07","Week end 07/05/2021",2021-05-01 00:00:00.000,2021-05-07 23:59:59.000,"Rolling week","Weekly"
"rollingweek_2021_05_08","Week end 08/05/2021",2021-05-02 00:00:00.000,2021-05-08 23:59:59.000,"Rolling week","Weekly"
"rollingweek_2021_05_09","Week end 09/05/2021",2021-05-03 00:00:00.000,2021-05-09 23:59:59.000,"Rolling week","Weekly"
"rollingweek_2021_05_10","Week end 10/05/2021",2021-05-04 00:00:00.000,2021-05-10 23:59:59.000,"Rolling week","Weekly"
"rollingweek_2021_05_11","Week end 11/05/2021",2021-05-05 00:00:00.000,2021-05-11 23:59:59.000,"Rolling week","Weekly"
"rollingweek_2021_05_12","Week end 12/05/2021",2021-05-06 00:00:00.000,2021-05-12 23:59:59.000,"Rolling week","Weekly"
"rollingweek_2021_05_13","Week end 13/05/2021",2021-05-07 00:00:00.000,2021-05-13 23:59:59.000,"Rolling week","Weekly"
"rollingweek_2021_05_14","Week end 14/05/2021",2021-05-08 00:00:00.000,2021-05-14 23:59:59.000,"Rolling week","Weekly"
"rollingweek_2021_05_15","Week end 15/05/2021",2021-05-09 00:00:00.000,2021-05-15 23:59:59.000,"Rolling week","Weekly"
"rollingweek_2021_05_16","Week end 16/05/2021",2021-05-10 00:00:00.000,2021-05-16 23:59:59.000,"Rolling week","Weekly"
"rollingweek_2021_05_17","Week end 17/05/2021",2021-05-11 00:00:00.000,2021-05-17 23:59:59.000,"Rolling week","Weekly"
"rollingweek_2021_05_18","Week end 18/05/2021",2021-05-12 00:00:00.000,2021-05-18 23:59:59.000,"Rolling week","Weekly"
"rollingweek_2021_05_19","Week end 19/05/2021",2021-05-13 00:00:00.000,2021-05-19 23:59:59.000,"Rolling week","Weekly"
"rollingweek_2021_05_20","Week end 20/05/2021",2021-05-14 00:00:00.000,2021-05-20 23:59:59.000,"Rolling week","Weekly"
"rollingweek_2021_05_21","Week end 21/05/2021",2021-05-15 00:00:00.000,2021-05-21 23:59:59.000,"Rolling week","Weekly"
"rollingweek_2021_05_22","Week end 22/05/2021",2021-05-16 00:00:00.000,2021-05-22 23:59:59.000,"Rolling week","Weekly"
"rollingweek_2021_05_23","Week end 23/05/2021",2021-05-17 00:00:00.000,2021-05-23 23:59:59.000,"Rolling week","Weekly"
"rollingweek_2021_05_24","Week end 24/05/2021",2021-05-18 00:00:00.000,2021-05-24 23:59:59.000,"Rolling week","Weekly"
"rollingweek_2021_05_25","Week end 25/05/2021",2021-05-19 00:00:00.000,2021-05-25 23:59:59.000,"Rolling week","Weekly"
"rollingweek_2021_05_26","Week end 26/05/2021",2021-05-20 00:00:00.000,2021-05-26 23:59:59.000,"Rolling week","Weekly"
"rollingweek_2021_05_27","Week end 27/05/2021",2021-05-21 00:00:00.000,2021-05-27 23:59:59.000,"Rolling week","Weekly"
"rollingweek_2021_05_28","Week end 28/05/2021",2021-05-22 00:00:00.000,2021-05-28 23:59:59.000,"Rolling week","Weekly"
"rollingweek_2021_05_29","Week end 29/05/2021",2021-05-23 00:00:00.000,2021-05-29 23:59:59.000,"Rolling week","Weekly"
"rollingweek_2021_05_30","Week end 30/05/2021",2021-05-24 00:00:00.000,2021-05-30 23:59:59.000,"Rolling week","Weekly"
"rollingweek_2021_05_31","Week end 31/05/2021",2021-05-25 00:00:00.000,2021-05-31 23:59:59.000,"Rolling week","Weekly"
"rollingweek_2021_06_01","Week end 01/06/2021",2021-05-26 00:00:00.000,2021-06-01 23:59:59.000,"Rolling week","Weekly"
"rollingweek_2021_06_02","Week end 02/06/2021",2021-05-27 00:00:00.000,2021-06-02 23:59:59.000,"Rolling week","Weekly"
"rollingweek_2021_06_03","Week end 03/06/2021",2021-05-28 00:00:00.000,2021-06-03 23:59:59.000,"Rolling week","Weekly"
"rollingweek_2021_06_04","Week end 04/06/2021",2021-05-29 00:00:00.000,2021-06-04 23:59:59.000,"Rolling week","Weekly"
"rollingweek_2021_06_05","Week end 05/06/2021",2021-05-30 00:00:00.000,2021-06-05 23:59:59.000,"Rolling week","Weekly"
"rollingweek_2021_06_06","Week end 06/06/2021",2021-05-31 00:00:00.000,2021-06-06 23:59:59.000,"Rolling week","Weekly"
"rollingweek_2021_06_07","Week end 07/06/2021",2021-06-01 00:00:00.000,2021-06-07 23:59:59.000,"Rolling week","Weekly"
"rollingweek_2021_06_08","Week end 08/06/2021",2021-06-02 00:00:00.000,2021-06-08 23:59:59.000,"Rolling week","Weekly"
"rollingweek_2021_06_09","Week end 09/06/2021",2021-06-03 00:00:00.000,2021-06-09 23:59:59.000,"Rolling week","Weekly"
"rollingweek_2021_06_10","Week end 10/06/2021",2021-06-04 00:00:00.000,2021-06-10 23:59:59.000,"Rolling week","Weekly"
"rollingweek_2021_06_11","Week end 11/06/2021",2021-06-05 00:00:00.000,2021-06-11 23:59:59.000,"Rolling week","Weekly"
"rollingweek_2021_06_12","Week end 12/06/2021",2021-06-06 00:00:00.000,2021-06-12 23:59:59.000,"Rolling week","Weekly"
"rollingweek_2021_06_13","Week end 13/06/2021",2021-06-07 00:00:00.000,2021-06-13 23:59:59.000,"Rolling week","Weekly"
"rollingweek_2021_06_14","Week end 14/06/2021",2021-06-08 00:00:00.000,2021-06-14 23:59:59.000,"Rolling week","Weekly"
"rollingweek_2021_06_15","Week end 15/06/2021",2021-06-09 00:00:00.000,2021-06-15 23:59:59.000,"Rolling week","Weekly"
"rollingweek_2021_06_16","Week end 16/06/2021",2021-06-10 00:00:00.000,2021-06-16 23:59:59.000,"Rolling week","Weekly"
"rollingweek_2021_06_17","Week end 17/06/2021",2021-06-11 00:00:00.000,2021-06-17 23:59:59.000,"Rolling week","Weekly"
"rollingweek_2021_06_18","Week end 18/06/2021",2021-06-12 00:00:00.000,2021-06-18 23:59:59.000,"Rolling week","Weekly"
"rollingweek_2021_06_19","Week end 19/06/2021",2021-06-13 00:00:00.000,2021-06-19 23:59:59.000,"Rolling week","Weekly"
"rollingweek_2021_06_20","Week end 20/06/2021",2021-06-14 00:00:00.000,2021-06-20 23:59:59.000,"Rolling week","Weekly"
"rollingweek_2021_06_21","Week end 21/06/2021",2021-06-15 00:00:00.000,2021-06-21 23:59:59.000,"Rolling week","Weekly"
"rollingweek_2021_06_22","Week end 22/06/2021",2021-06-16 00:00:00.000,2021-06-22 23:59:59.000,"Rolling week","Weekly"
"rollingweek_2021_06_23","Week end 23/06/2021",2021-06-17 00:00:00.000,2021-06-23 23:59:59.000,"Rolling week","Weekly"
"rollingweek_2021_06_24","Week end 24/06/2021",2021-06-18 00:00:00.000,2021-06-24 23:59:59.000,"Rolling week","Weekly"
"rollingweek_2021_06_25","Week end 25/06/2021",2021-06-19 00:00:00.000,2021-06-25 23:59:59.000,"Rolling week","Weekly"
"rollingweek_2021_06_26","Week end 26/06/2021",2021-06-20 00:00:00.000,2021-06-26 23:59:59.000,"Rolling week","Weekly"
"rollingweek_2021_06_27","Week end 27/06/2021",2021-06-21 00:00:00.000,2021-06-27 23:59:59.000,"Rolling week","Weekly"
"rollingweek_2021_06_28","Week end 28/06/2021",2021-06-22 00:00:00.000,2021-06-28 23:59:59.000,"Rolling week","Weekly"
"rollingweek_2021_06_29","Week end 29/06/2021",2021-06-23 00:00:00.000,2021-06-29 23:59:59.000,"Rolling week","Weekly"
"rollingweek_2021_06_30","Week end 30/06/2021",2021-06-24 00:00:00.000,2021-06-30 23:59:59.000,"Rolling week","Weekly"
"rollingweek_2021_07_01","Week end 01/07/2021",2021-06-25 00:00:00.000,2021-07-01 23:59:59.000,"Rolling week","Weekly"
"rollingweek_2021_07_02","Week end 02/07/2021",2021-06-26 00:00:00.000,2021-07-02 23:59:59.000,"Rolling week","Weekly"
"rollingweek_2021_07_03","Week end 03/07/2021",2021-06-27 00:00:00.000,2021-07-03 23:59:59.000,"Rolling week","Weekly"
"rollingweek_2021_07_04","Week end 04/07/2021",2021-06-28 00:00:00.000,2021-07-04 23:59:59.000,"Rolling week","Weekly"
"rollingweek_2021_07_05","Week end 05/07/2021",2021-06-29 00:00:00.000,2021-07-05 23:59:59.000,"Rolling week","Weekly"
"rollingweek_2021_07_06","Week end 06/07/2021",2021-06-30 00:00:00.000,2021-07-06 23:59:59.000,"Rolling week","Weekly"
"rollingweek_2021_07_07","Week end 07/07/2021",2021-07-01 00:00:00.000,2021-07-07 23:59:59.000,"Rolling week","Weekly"
"rollingweek_2021_07_08","Week end 08/07/2021",2021-07-02 00:00:00.000,2021-07-08 23:59:59.000,"Rolling week","Weekly"
"rollingweek_2021_07_09","Week end 09/07/2021",2021-07-03 00:00:00.000,2021-07-09 23:59:59.000,"Rolling week","Weekly"
"rollingweek_2021_07_10","Week end 10/07/2021",2021-07-04 00:00:00.000,2021-07-10 23:59:59.000,"Rolling week","Weekly"
"rollingweek_2021_07_11","Week end 11/07/2021",2021-07-05 00:00:00.000,2021-07-11 23:59:59.000,"Rolling week","Weekly"
"rollingweek_2021_07_12","Week end 12/07/2021",2021-07-06 00:00:00.000,2021-07-12 23:59:59.000,"Rolling week","Weekly"
"rollingweek_2021_07_13","Week end 13/07/2021",2021-07-07 00:00:00.000,2021-07-13 23:59:59.000,"Rolling week","Weekly"
"rollingweek_2021_07_14","Week end 14/07/2021",2021-07-08 00:00:00.000,2021-07-14 23:59:59.000,"Rolling week","Weekly"
"rollingweek_2021_07_15","Week end 15/07/2021",2021-07-09 00:00:00.000,2021-07-15 23:59:59.000,"Rolling week","Weekly"
"rollingweek_2021_07_16","Week end 16/07/2021",2021-07-10 00:00:00.000,2021-07-16 23:59:59.000,"Rolling week","Weekly"
"rollingweek_2021_07_17","Week end 17/07/2021",2021-07-11 00:00:00.000,2021-07-17 23:59:59.000,"Rolling week","Weekly"
"rollingweek_2021_07_18","Week end 18/07/2021",2021-07-12 00:00:00.000,2021-07-18 23:59:59.000,"Rolling week","Weekly"
"rollingweek_2021_07_19","Week end 19/07/2021",2021-07-13 00:00:00.000,2021-07-19 23:59:59.000,"Rolling week","Weekly"
"rollingweek_2021_07_20","Week end 20/07/2021",2021-07-14 00:00:00.000,2021-07-20 23:59:59.000,"Rolling week","Weekly"
"rollingweek_2021_07_21","Week end 21/07/2021",2021-07-15 00:00:00.000,2021-07-21 23:59:59.000,"Rolling week","Weekly"
"rollingweek_2021_07_22","Week end 22/07/2021",2021-07-16 00:00:00.000,2021-07-22 23:59:59.000,"Rolling week","Weekly"
"rollingweek_2021_07_23","Week end 23/07/2021",2021-07-17 00:00:00.000,2021-07-23 23:59:59.000,"Rolling week","Weekly"
"rollingweek_2021_07_24","Week end 24/07/2021",2021-07-18 00:00:00.000,2021-07-24 23:59:59.000,"Rolling week","Weekly"
"rollingweek_2021_07_25","Week end 25/07/2021",2021-07-19 00:00:00.000,2021-07-25 23:59:59.000,"Rolling week","Weekly"
"rollingweek_2021_07_26","Week end 26/07/2021",2021-07-20 00:00:00.000,2021-07-26 23:59:59.000,"Rolling week","Weekly"
"rollingweek_2021_07_27","Week end 27/07/2021",2021-07-21 00:00:00.000,2021-07-27 23:59:59.000,"Rolling week","Weekly"
"rollingweek_2021_07_28","Week end 28/07/2021",2021-07-22 00:00:00.000,2021-07-28 23:59:59.000,"Rolling week","Weekly"
"rollingweek_2021_07_29","Week end 29/07/2021",2021-07-23 00:00:00.000,2021-07-29 23:59:59.000,"Rolling week","Weekly"
"rollingweek_2021_07_30","Week end 30/07/2021",2021-07-24 00:00:00.000,2021-07-30 23:59:59.000,"Rolling week","Weekly"
"rollingweek_2021_07_31","Week end 31/07/2021",2021-07-25 00:00:00.000,2021-07-31 23:59:59.000,"Rolling week","Weekly"
"rollingweek_2021_08_01","Week end 01/08/2021",2021-07-26 00:00:00.000,2021-08-01 23:59:59.000,"Rolling week","Weekly"
"rollingweek_2021_08_02","Week end 02/08/2021",2021-07-27 00:00:00.000,2021-08-02 23:59:59.000,"Rolling week","Weekly"
"rollingweek_2021_08_03","Week end 03/08/2021",2021-07-28 00:00:00.000,2021-08-03 23:59:59.000,"Rolling week","Weekly"
"rollingweek_2021_08_04","Week end 04/08/2021",2021-07-29 00:00:00.000,2021-08-04 23:59:59.000,"Rolling week","Weekly"
"rollingweek_2021_08_05","Week end 05/08/2021",2021-07-30 00:00:00.000,2021-08-05 23:59:59.000,"Rolling week","Weekly"
"rollingweek_2021_08_06","Week end 06/08/2021",2021-07-31 00:00:00.000,2021-08-06 23:59:59.000,"Rolling week","Weekly"
"rollingweek_2021_08_07","Week end 07/08/2021",2021-08-01 00:00:00.000,2021-08-07 23:59:59.000,"Rolling week","Weekly"
"rollingweek_2021_08_08","Week end 08/08/2021",2021-08-02 00:00:00.000,2021-08-08 23:59:59.000,"Rolling week","Weekly"
"rollingweek_2021_08_09","Week end 09/08/2021",2021-08-03 00:00:00.000,2021-08-09 23:59:59.000,"Rolling week","Weekly"
"rollingweek_2021_08_10","Week end 10/08/2021",2021-08-04 00:00:00.000,2021-08-10 23:59:59.000,"Rolling week","Weekly"
"rollingweek_2021_08_11","Week end 11/08/2021",2021-08-05 00:00:00.000,2021-08-11 23:59:59.000,"Rolling week","Weekly"
"rollingweek_2021_08_12","Week end 12/08/2021",2021-08-06 00:00:00.000,2021-08-12 23:59:59.000,"Rolling week","Weekly"
"rollingweek_2021_08_13","Week end 13/08/2021",2021-08-07 00:00:00.000,2021-08-13 23:59:59.000,"Rolling week","Weekly"
"rollingweek_2021_08_14","Week end 14/08/2021",2021-08-08 00:00:00.000,2021-08-14 23:59:59.000,"Rolling week","Weekly"
"rollingweek_2021_08_15","Week end 15/08/2021",2021-08-09 00:00:00.000,2021-08-15 23:59:59.000,"Rolling week","Weekly"
"rollingweek_2021_08_16","Week end 16/08/2021",2021-08-10 00:00:00.000,2021-08-16 23:59:59.000,"Rolling week","Weekly"
"rollingweek_2021_08_17","Week end 17/08/2021",2021-08-11 00:00:00.000,2021-08-17 23:59:59.000,"Rolling week","Weekly"
"rollingweek_2021_08_18","Week end 18/08/2021",2021-08-12 00:00:00.000,2021-08-18 23:59:59.000,"Rolling week","Weekly"
"rollingweek_2021_08_19","Week end 19/08/2021",2021-08-13 00:00:00.000,2021-08-19 23:59:59.000,"Rolling week","Weekly"
"rollingweek_2021_08_20","Week end 20/08/2021",2021-08-14 00:00:00.000,2021-08-20 23:59:59.000,"Rolling week","Weekly"
"rollingweek_2021_08_21","Week end 21/08/2021",2021-08-15 00:00:00.000,2021-08-21 23:59:59.000,"Rolling week","Weekly"
"rollingweek_2021_08_22","Week end 22/08/2021",2021-08-16 00:00:00.000,2021-08-22 23:59:59.000,"Rolling week","Weekly"
"rollingweek_2021_08_23","Week end 23/08/2021",2021-08-17 00:00:00.000,2021-08-23 23:59:59.000,"Rolling week","Weekly"
"rollingweek_2021_08_24","Week end 24/08/2021",2021-08-18 00:00:00.000,2021-08-24 23:59:59.000,"Rolling week","Weekly"
"rollingweek_2021_08_25","Week end 25/08/2021",2021-08-19 00:00:00.000,2021-08-25 23:59:59.000,"Rolling week","Weekly"
"rollingweek_2021_08_26","Week end 26/08/2021",2021-08-20 00:00:00.000,2021-08-26 23:59:59.000,"Rolling week","Weekly"
"rollingweek_2021_08_27","Week end 27/08/2021",2021-08-21 00:00:00.000,2021-08-27 23:59:59.000,"Rolling week","Weekly"
"rollingweek_2021_08_28","Week end 28/08/2021",2021-08-22 00:00:00.000,2021-08-28 23:59:59.000,"Rolling week","Weekly"
"rollingweek_2021_08_29","Week end 29/08/2021",2021-08-23 00:00:00.000,2021-08-29 23:59:59.000,"Rolling week","Weekly"
"rollingweek_2021_08_30","Week end 30/08/2021",2021-08-24 00:00:00.000,2021-08-30 23:59:59.000,"Rolling week","Weekly"
"rollingweek_2021_08_31","Week end 31/08/2021",2021-08-25 00:00:00.000,2021-08-31 23:59:59.000,"Rolling week","Weekly"
"rollingweek_2021_09_01","Week end 01/09/2021",2021-08-26 00:00:00.000,2021-09-01 23:59:59.000,"Rolling week","Weekly"
"rollingweek_2021_09_02","Week end 02/09/2021",2021-08-27 00:00:00.000,2021-09-02 23:59:59.000,"Rolling week","Weekly"
"rollingweek_2021_09_03","Week end 03/09/2021",2021-08-28 00:00:00.000,2021-09-03 23:59:59.000,"Rolling week","Weekly"
"rollingweek_2021_09_04","Week end 04/09/2021",2021-08-29 00:00:00.000,2021-09-04 23:59:59.000,"Rolling week","Weekly"
"rollingweek_2021_09_05","Week end 05/09/2021",2021-08-30 00:00:00.000,2021-09-05 23:59:59.000,"Rolling week","Weekly"
"rollingweek_2021_09_06","Week end 06/09/2021",2021-08-31 00:00:00.000,2021-09-06 23:59:59.000,"Rolling week","Weekly"
"rollingweek_2021_09_07","Week end 07/09/2021",2021-09-01 00:00:00.000,2021-09-07 23:59:59.000,"Rolling week","Weekly"
"rollingweek_2021_09_08","Week end 08/09/2021",2021-09-02 00:00:00.000,2021-09-08 23:59:59.000,"Rolling week","Weekly"
"rollingweek_2021_09_09","Week end 09/09/2021",2021-09-03 00:00:00.000,2021-09-09 23:59:59.000,"Rolling week","Weekly"
"rollingweek_2021_09_10","Week end 10/09/2021",2021-09-04 00:00:00.000,2021-09-10 23:59:59.000,"Rolling week","Weekly"
"rollingweek_2021_09_11","Week end 11/09/2021",2021-09-05 00:00:00.000,2021-09-11 23:59:59.000,"Rolling week","Weekly"
"rollingweek_2021_09_12","Week end 12/09/2021",2021-09-06 00:00:00.000,2021-09-12 23:59:59.000,"Rolling week","Weekly"
"rollingweek_2021_09_13","Week end 13/09/2021",2021-09-07 00:00:00.000,2021-09-13 23:59:59.000,"Rolling week","Weekly"
"rollingweek_2021_09_14","Week end 14/09/2021",2021-09-08 00:00:00.000,2021-09-14 23:59:59.000,"Rolling week","Weekly"
"rollingweek_2021_09_15","Week end 15/09/2021",2021-09-09 00:00:00.000,2021-09-15 23:59:59.000,"Rolling week","Weekly"
"rollingweek_2021_09_16","Week end 16/09/2021",2021-09-10 00:00:00.000,2021-09-16 23:59:59.000,"Rolling week","Weekly"
"rollingweek_2021_09_17","Week end 17/09/2021",2021-09-11 00:00:00.000,2021-09-17 23:59:59.000,"Rolling week","Weekly"
"rollingweek_2021_09_18","Week end 18/09/2021",2021-09-12 00:00:00.000,2021-09-18 23:59:59.000,"Rolling week","Weekly"
"rollingweek_2021_09_19","Week end 19/09/2021",2021-09-13 00:00:00.000,2021-09-19 23:59:59.000,"Rolling week","Weekly"
"rollingweek_2021_09_20","Week end 20/09/2021",2021-09-14 00:00:00.000,2021-09-20 23:59:59.000,"Rolling week","Weekly"
"rollingweek_2021_09_21","Week end 21/09/2021",2021-09-15 00:00:00.000,2021-09-21 23:59:59.000,"Rolling week","Weekly"
"rollingweek_2021_09_22","Week end 22/09/2021",2021-09-16 00:00:00.000,2021-09-22 23:59:59.000,"Rolling week","Weekly"
"rollingweek_2021_09_23","Week end 23/09/2021",2021-09-17 00:00:00.000,2021-09-23 23:59:59.000,"Rolling week","Weekly"
"rollingweek_2021_09_24","Week end 24/09/2021",2021-09-18 00:00:00.000,2021-09-24 23:59:59.000,"Rolling week","Weekly"
"rollingweek_2021_09_25","Week end 25/09/2021",2021-09-19 00:00:00.000,2021-09-25 23:59:59.000,"Rolling week","Weekly"
"rollingweek_2021_09_26","Week end 26/09/2021",2021-09-20 00:00:00.000,2021-09-26 23:59:59.000,"Rolling week","Weekly"
"rollingweek_2021_09_27","Week end 27/09/2021",2021-09-21 00:00:00.000,2021-09-27 23:59:59.000,"Rolling week","Weekly"
"rollingweek_2021_09_28","Week end 28/09/2021",2021-09-22 00:00:00.000,2021-09-28 23:59:59.000,"Rolling week","Weekly"
"rollingweek_2021_09_29","Week end 29/09/2021",2021-09-23 00:00:00.000,2021-09-29 23:59:59.000,"Rolling week","Weekly"
"rollingweek_2021_09_30","Week end 30/09/2021",2021-09-24 00:00:00.000,2021-09-30 23:59:59.000,"Rolling week","Weekly"
"rollingweek_2021_10_01","Week end 01/10/2021",2021-09-25 00:00:00.000,2021-10-01 23:59:59.000,"Rolling week","Weekly"
"rollingweek_2021_10_02","Week end 02/10/2021",2021-09-26 00:00:00.000,2021-10-02 23:59:59.000,"Rolling week","Weekly"
"rollingweek_2021_10_03","Week end 03/10/2021",2021-09-27 00:00:00.000,2021-10-03 23:59:59.000,"Rolling week","Weekly"
"rollingweek_2021_10_04","Week end 04/10/2021",2021-09-28 00:00:00.000,2021-10-04 23:59:59.000,"Rolling week","Weekly"
"rollingweek_2021_10_05","Week end 05/10/2021",2021-09-29 00:00:00.000,2021-10-05 23:59:59.000,"Rolling week","Weekly"
"rollingweek_2021_10_06","Week end 06/10/2021",2021-09-30 00:00:00.000,2021-10-06 23:59:59.000,"Rolling week","Weekly"
"rollingweek_2021_10_07","Week end 07/10/2021",2021-10-01 00:00:00.000,2021-10-07 23:59:59.000,"Rolling week","Weekly"
"rollingweek_2021_10_08","Week end 08/10/2021",2021-10-02 00:00:00.000,2021-10-08 23:59:59.000,"Rolling week","Weekly"
"rollingweek_2021_10_09","Week end 09/10/2021",2021-10-03 00:00:00.000,2021-10-09 23:59:59.000,"Rolling week","Weekly"
"rollingweek_2021_10_10","Week end 10/10/2021",2021-10-04 00:00:00.000,2021-10-10 23:59:59.000,"Rolling week","Weekly"
"rollingweek_2021_10_11","Week end 11/10/2021",2021-10-05 00:00:00.000,2021-10-11 23:59:59.000,"Rolling week","Weekly"
"rollingweek_2021_10_12","Week end 12/10/2021",2021-10-06 00:00:00.000,2021-10-12 23:59:59.000,"Rolling week","Weekly"
"rollingweek_2021_10_13","Week end 13/10/2021",2021-10-07 00:00:00.000,2021-10-13 23:59:59.000,"Rolling week","Weekly"
"rollingweek_2021_10_14","Week end 14/10/2021",2021-10-08 00:00:00.000,2021-10-14 23:59:59.000,"Rolling week","Weekly"
"rollingweek_2021_10_15","Week end 15/10/2021",2021-10-09 00:00:00.000,2021-10-15 23:59:59.000,"Rolling week","Weekly"
"rollingweek_2021_10_16","Week end 16/10/2021",2021-10-10 00:00:00.000,2021-10-16 23:59:59.000,"Rolling week","Weekly"
"rollingweek_2021_10_17","Week end 17/10/2021",2021-10-11 00:00:00.000,2021-10-17 23:59:59.000,"Rolling week","Weekly"
"rollingweek_2021_10_18","Week end 18/10/2021",2021-10-12 00:00:00.000,2021-10-18 23:59:59.000,"Rolling week","Weekly"
"rollingweek_2021_10_19","Week end 19/10/2021",2021-10-13 00:00:00.000,2021-10-19 23:59:59.000,"Rolling week","Weekly"
"rollingweek_2021_10_20","Week end 20/10/2021",2021-10-14 00:00:00.000,2021-10-20 23:59:59.000,"Rolling week","Weekly"
"rollingweek_2021_10_21","Week end 21/10/2021",2021-10-15 00:00:00.000,2021-10-21 23:59:59.000,"Rolling week","Weekly"
"rollingweek_2021_10_22","Week end 22/10/2021",2021-10-16 00:00:00.000,2021-10-22 23:59:59.000,"Rolling week","Weekly"
"rollingweek_2021_10_23","Week end 23/10/2021",2021-10-17 00:00:00.000,2021-10-23 23:59:59.000,"Rolling week","Weekly"
"rollingweek_2021_10_24","Week end 24/10/2021",2021-10-18 00:00:00.000,2021-10-24 23:59:59.000,"Rolling week","Weekly"
"rollingweek_2021_10_25","Week end 25/10/2021",2021-10-19 00:00:00.000,2021-10-25 23:59:59.000,"Rolling week","Weekly"
"rollingweek_2021_10_26","Week end 26/10/2021",2021-10-20 00:00:00.000,2021-10-26 23:59:59.000,"Rolling week","Weekly"
"rollingweek_2021_10_27","Week end 27/10/2021",2021-10-21 00:00:00.000,2021-10-27 23:59:59.000,"Rolling week","Weekly"
"rollingweek_2021_10_28","Week end 28/10/2021",2021-10-22 00:00:00.000,2021-10-28 23:59:59.000,"Rolling week","Weekly"
"rollingweek_2021_10_29","Week end 29/10/2021",2021-10-23 00:00:00.000,2021-10-29 23:59:59.000,"Rolling week","Weekly"
"rollingweek_2021_10_30","Week end 30/10/2021",2021-10-24 00:00:00.000,2021-10-30 23:59:59.000,"Rolling week","Weekly"
"rollingweek_2021_10_31","Week end 31/10/2021",2021-10-25 00:00:00.000,2021-10-31 23:59:59.000,"Rolling week","Weekly"
"rollingweek_2021_11_01","Week end 01/11/2021",2021-10-26 00:00:00.000,2021-11-01 23:59:59.000,"Rolling week","Weekly"
"rollingweek_2021_11_02","Week end 02/11/2021",2021-10-27 00:00:00.000,2021-11-02 23:59:59.000,"Rolling week","Weekly"
"rollingweek_2021_11_03","Week end 03/11/2021",2021-10-28 00:00:00.000,2021-11-03 23:59:59.000,"Rolling week","Weekly"
"rollingweek_2021_11_04","Week end 04/11/2021",2021-10-29 00:00:00.000,2021-11-04 23:59:59.000,"Rolling week","Weekly"
"rollingweek_2021_11_05","Week end 05/11/2021",2021-10-30 00:00:00.000,2021-11-05 23:59:59.000,"Rolling week","Weekly"
"rollingweek_2021_11_06","Week end 06/11/2021",2021-10-31 00:00:00.000,2021-11-06 23:59:59.000,"Rolling week","Weekly"
"rollingweek_2021_11_07","Week end 07/11/2021",2021-11-01 00:00:00.000,2021-11-07 23:59:59.000,"Rolling week","Weekly"
"rollingweek_2021_11_08","Week end 08/11/2021",2021-11-02 00:00:00.000,2021-11-08 23:59:59.000,"Rolling week","Weekly"
"rollingweek_2021_11_09","Week end 09/11/2021",2021-11-03 00:00:00.000,2021-11-09 23:59:59.000,"Rolling week","Weekly"
"rollingweek_2021_11_10","Week end 10/11/2021",2021-11-04 00:00:00.000,2021-11-10 23:59:59.000,"Rolling week","Weekly"
"rollingweek_2021_11_11","Week end 11/11/2021",2021-11-05 00:00:00.000,2021-11-11 23:59:59.000,"Rolling week","Weekly"
"rollingweek_2021_11_12","Week end 12/11/2021",2021-11-06 00:00:00.000,2021-11-12 23:59:59.000,"Rolling week","Weekly"
"rollingweek_2021_11_13","Week end 13/11/2021",2021-11-07 00:00:00.000,2021-11-13 23:59:59.000,"Rolling week","Weekly"
"rollingweek_2021_11_14","Week end 14/11/2021",2021-11-08 00:00:00.000,2021-11-14 23:59:59.000,"Rolling week","Weekly"
"rollingweek_2021_11_15","Week end 15/11/2021",2021-11-09 00:00:00.000,2021-11-15 23:59:59.000,"Rolling week","Weekly"
"rollingweek_2021_11_16","Week end 16/11/2021",2021-11-10 00:00:00.000,2021-11-16 23:59:59.000,"Rolling week","Weekly"
"rollingweek_2021_11_17","Week end 17/11/2021",2021-11-11 00:00:00.000,2021-11-17 23:59:59.000,"Rolling week","Weekly"
"rollingweek_2021_11_18","Week end 18/11/2021",2021-11-12 00:00:00.000,2021-11-18 23:59:59.000,"Rolling week","Weekly"
"rollingweek_2021_11_19","Week end 19/11/2021",2021-11-13 00:00:00.000,2021-11-19 23:59:59.000,"Rolling week","Weekly"
"rollingweek_2021_11_20","Week end 20/11/2021",2021-11-14 00:00:00.000,2021-11-20 23:59:59.000,"Rolling week","Weekly"
"rollingweek_2021_11_21","Week end 21/11/2021",2021-11-15 00:00:00.000,2021-11-21 23:59:59.000,"Rolling week","Weekly"
"rollingweek_2021_11_22","Week end 22/11/2021",2021-11-16 00:00:00.000,2021-11-22 23:59:59.000,"Rolling week","Weekly"
"rollingweek_2021_11_23","Week end 23/11/2021",2021-11-17 00:00:00.000,2021-11-23 23:59:59.000,"Rolling week","Weekly"
"rollingweek_2021_11_24","Week end 24/11/2021",2021-11-18 00:00:00.000,2021-11-24 23:59:59.000,"Rolling week","Weekly"
"rollingweek_2021_11_25","Week end 25/11/2021",2021-11-19 00:00:00.000,2021-11-25 23:59:59.000,"Rolling week","Weekly"
"rollingweek_2021_11_26","Week end 26/11/2021",2021-11-20 00:00:00.000,2021-11-26 23:59:59.000,"Rolling week","Weekly"
"rollingweek_2021_11_27","Week end 27/11/2021",2021-11-21 00:00:00.000,2021-11-27 23:59:59.000,"Rolling week","Weekly"
"rollingweek_2021_11_28","Week end 28/11/2021",2021-11-22 00:00:00.000,2021-11-28 23:59:59.000,"Rolling week","Weekly"
"rollingweek_2021_11_29","Week end 29/11/2021",2021-11-23 00:00:00.000,2021-11-29 23:59:59.000,"Rolling week","Weekly"
"rollingweek_2021_11_30","Week end 30/11/2021",2021-11-24 00:00:00.000,2021-11-30 23:59:59.000,"Rolling week","Weekly"
"rollingweek_2021_12_01","Week end 01/12/2021",2021-11-25 00:00:00.000,2021-12-01 23:59:59.000,"Rolling week","Weekly"
"rollingweek_2021_12_02","Week end 02/12/2021",2021-11-26 00:00:00.000,2021-12-02 23:59:59.000,"Rolling week","Weekly"
"rollingweek_2021_12_03","Week end 03/12/2021",2021-11-27 00:00:00.000,2021-12-03 23:59:59.000,"Rolling week","Weekly"
"rollingweek_2021_12_04","Week end 04/12/2021",2021-11-28 00:00:00.000,2021-12-04 23:59:59.000,"Rolling week","Weekly"
"rollingweek_2021_12_05","Week end 05/12/2021",2021-11-29 00:00:00.000,2021-12-05 23:59:59.000,"Rolling week","Weekly"
"rollingweek_2021_12_06","Week end 06/12/2021",2021-11-30 00:00:00.000,2021-12-06 23:59:59.000,"Rolling week","Weekly"
"rollingweek_2021_12_07","Week end 07/12/2021",2021-12-01 00:00:00.000,2021-12-07 23:59:59.000,"Rolling week","Weekly"
"rollingweek_2021_12_08","Week end 08/12/2021",2021-12-02 00:00:00.000,2021-12-08 23:59:59.000,"Rolling week","Weekly"
"rollingweek_2021_12_09","Week end 09/12/2021",2021-12-03 00:00:00.000,2021-12-09 23:59:59.000,"Rolling week","Weekly"
"rollingweek_2021_12_10","Week end 10/12/2021",2021-12-04 00:00:00.000,2021-12-10 23:59:59.000,"Rolling week","Weekly"
"rollingweek_2021_12_11","Week end 11/12/2021",2021-12-05 00:00:00.000,2021-12-11 23:59:59.000,"Rolling week","Weekly"
"rollingweek_2021_12_12","Week end 12/12/2021",2021-12-06 00:00:00.000,2021-12-12 23:59:59.000,"Rolling week","Weekly"
"rollingweek_2021_12_13","Week end 13/12/2021",2021-12-07 00:00:00.000,2021-12-13 23:59:59.000,"Rolling week","Weekly"
"rollingweek_2021_12_14","Week end 14/12/2021",2021-12-08 00:00:00.000,2021-12-14 23:59:59.000,"Rolling week","Weekly"
"rollingweek_2021_12_15","Week end 15/12/2021",2021-12-09 00:00:00.000,2021-12-15 23:59:59.000,"Rolling week","Weekly"
"rollingweek_2021_12_16","Week end 16/12/2021",2021-12-10 00:00:00.000,2021-12-16 23:59:59.000,"Rolling week","Weekly"
"rollingweek_2021_12_17","Week end 17/12/2021",2021-12-11 00:00:00.000,2021-12-17 23:59:59.000,"Rolling week","Weekly"
"rollingweek_2021_12_18","Week end 18/12/2021",2021-12-12 00:00:00.000,2021-12-18 23:59:59.000,"Rolling week","Weekly"
"rollingweek_2021_12_19","Week end 19/12/2021",2021-12-13 00:00:00.000,2021-12-19 23:59:59.000,"Rolling week","Weekly"
"rollingweek_2021_12_20","Week end 20/12/2021",2021-12-14 00:00:00.000,2021-12-20 23:59:59.000,"Rolling week","Weekly"
"rollingweek_2021_12_21","Week end 21/12/2021",2021-12-15 00:00:00.000,2021-12-21 23:59:59.000,"Rolling week","Weekly"
"rollingweek_2021_12_22","Week end 22/12/2021",2021-12-16 00:00:00.000,2021-12-22 23:59:59.000,"Rolling week","Weekly"
"rollingweek_2021_12_23","Week end 23/12/2021",2021-12-17 00:00:00.000,2021-12-23 23:59:59.000,"Rolling week","Weekly"
"rollingweek_2021_12_24","Week end 24/12/2021",2021-12-18 00:00:00.000,2021-12-24 23:59:59.000,"Rolling week","Weekly"
"rollingweek_2021_12_25","Week end 25/12/2021",2021-12-19 00:00:00.000,2021-12-25 23:59:59.000,"Rolling week","Weekly"
"rollingweek_2021_12_26","Week end 26/12/2021",2021-12-20 00:00:00.000,2021-12-26 23:59:59.000,"Rolling week","Weekly"
"rollingweek_2021_12_27","Week end 27/12/2021",2021-12-21 00:00:00.000,2021-12-27 23:59:59.000,"Rolling week","Weekly"
"rollingweek_2021_12_28","Week end 28/12/2021",2021-12-22 00:00:00.000,2021-12-28 23:59:59.000,"Rolling week","Weekly"
"rollingweek_2021_12_29","Week end 29/12/2021",2021-12-23 00:00:00.000,2021-12-29 23:59:59.000,"Rolling week","Weekly"
"rollingweek_2021_12_30","Week end 30/12/2021",2021-12-24 00:00:00.000,2021-12-30 23:59:59.000,"Rolling week","Weekly"
"rollingweek_2021_12_31","Week end 31/12/2021",2021-12-25 00:00:00.000,2021-12-31 23:59:59.000,"Rolling week","Weekly"
"rollingweek_2022_01_01","Week end 01/01/2022",2021-12-26 00:00:00.000,2022-01-01 23:59:59.000,"Rolling week","Weekly"
"rollingweek_2022_01_02","Week end 02/01/2022",2021-12-27 00:00:00.000,2022-01-02 23:59:59.000,"Rolling week","Weekly"
"rollingweek_2022_01_03","Week end 03/01/2022",2021-12-28 00:00:00.000,2022-01-03 23:59:59.000,"Rolling week","Weekly"
"rollingweek_2022_01_04","Week end 04/01/2022",2021-12-29 00:00:00.000,2022-01-04 23:59:59.000,"Rolling week","Weekly"
"rollingweek_2022_01_05","Week end 05/01/2022",2021-12-30 00:00:00.000,2022-01-05 23:59:59.000,"Rolling week","Weekly"
"rollingweek_2022_01_06","Week end 06/01/2022",2021-12-31 00:00:00.000,2022-01-06 23:59:59.000,"Rolling week","Weekly"
"rollingweek_2022_01_07","Week end 07/01/2022",2022-01-01 00:00:00.000,2022-01-07 23:59:59.000,"Rolling week","Weekly"
"rollingweek_2022_01_08","Week end 08/01/2022",2022-01-02 00:00:00.000,2022-01-08 23:59:59.000,"Rolling week","Weekly"
"rollingweek_2022_01_09","Week end 09/01/2022",2022-01-03 00:00:00.000,2022-01-09 23:59:59.000,"Rolling week","Weekly"
"rollingweek_2022_01_10","Week end 10/01/2022",2022-01-04 00:00:00.000,2022-01-10 23:59:59.000,"Rolling week","Weekly"
"rollingweek_2022_01_11","Week end 11/01/2022",2022-01-05 00:00:00.000,2022-01-11 23:59:59.000,"Rolling week","Weekly"
"rollingweek_2022_01_12","Week end 12/01/2022",2022-01-06 00:00:00.000,2022-01-12 23:59:59.000,"Rolling week","Weekly"
"rollingweek_2022_01_13","Week end 13/01/2022",2022-01-07 00:00:00.000,2022-01-13 23:59:59.000,"Rolling week","Weekly"
"rollingweek_2022_01_14","Week end 14/01/2022",2022-01-08 00:00:00.000,2022-01-14 23:59:59.000,"Rolling week","Weekly"
"rollingweek_2022_01_15","Week end 15/01/2022",2022-01-09 00:00:00.000,2022-01-15 23:59:59.000,"Rolling week","Weekly"
"rollingweek_2022_01_16","Week end 16/01/2022",2022-01-10 00:00:00.000,2022-01-16 23:59:59.000,"Rolling week","Weekly"
"rollingweek_2022_01_17","Week end 17/01/2022",2022-01-11 00:00:00.000,2022-01-17 23:59:59.000,"Rolling week","Weekly"
"rollingweek_2022_01_18","Week end 18/01/2022",2022-01-12 00:00:00.000,2022-01-18 23:59:59.000,"Rolling week","Weekly"
"rollingweek_2022_01_19","Week end 19/01/2022",2022-01-13 00:00:00.000,2022-01-19 23:59:59.000,"Rolling week","Weekly"
"rollingweek_2022_01_20","Week end 20/01/2022",2022-01-14 00:00:00.000,2022-01-20 23:59:59.000,"Rolling week","Weekly"
"rollingweek_2022_01_21","Week end 21/01/2022",2022-01-15 00:00:00.000,2022-01-21 23:59:59.000,"Rolling week","Weekly"
"rollingweek_2022_01_22","Week end 22/01/2022",2022-01-16 00:00:00.000,2022-01-22 23:59:59.000,"Rolling week","Weekly"
"rollingweek_2022_01_23","Week end 23/01/2022",2022-01-17 00:00:00.000,2022-01-23 23:59:59.000,"Rolling week","Weekly"
"rollingweek_2022_01_24","Week end 24/01/2022",2022-01-18 00:00:00.000,2022-01-24 23:59:59.000,"Rolling week","Weekly"
"rollingweek_2022_01_25","Week end 25/01/2022",2022-01-19 00:00:00.000,2022-01-25 23:59:59.000,"Rolling week","Weekly"
"rollingweek_2022_01_26","Week end 26/01/2022",2022-01-20 00:00:00.000,2022-01-26 23:59:59.000,"Rolling week","Weekly"
"rollingweek_2022_01_27","Week end 27/01/2022",2022-01-21 00:00:00.000,2022-01-27 23:59:59.000,"Rolling week","Weekly"
"rollingweek_2022_01_28","Week end 28/01/2022",2022-01-22 00:00:00.000,2022-01-28 23:59:59.000,"Rolling week","Weekly"
"rollingweek_2022_01_29","Week end 29/01/2022",2022-01-23 00:00:00.000,2022-01-29 23:59:59.000,"Rolling week","Weekly"
"rollingweek_2022_01_30","Week end 30/01/2022",2022-01-24 00:00:00.000,2022-01-30 23:59:59.000,"Rolling week","Weekly"
"rollingweek_2022_01_31","Week end 31/01/2022",2022-01-25 00:00:00.000,2022-01-31 23:59:59.000,"Rolling week","Weekly"
"rollingweek_2022_02_01","Week end 01/02/2022",2022-01-26 00:00:00.000,2022-02-01 23:59:59.000,"Rolling week","Weekly"
"rollingweek_2022_02_02","Week end 02/02/2022",2022-01-27 00:00:00.000,2022-02-02 23:59:59.000,"Rolling week","Weekly"
"rollingweek_2022_02_03","Week end 03/02/2022",2022-01-28 00:00:00.000,2022-02-03 23:59:59.000,"Rolling week","Weekly"
"rollingweek_2022_02_04","Week end 04/02/2022",2022-01-29 00:00:00.000,2022-02-04 23:59:59.000,"Rolling week","Weekly"
"rollingweek_2022_02_05","Week end 05/02/2022",2022-01-30 00:00:00.000,2022-02-05 23:59:59.000,"Rolling week","Weekly"
"rollingweek_2022_02_06","Week end 06/02/2022",2022-01-31 00:00:00.000,2022-02-06 23:59:59.000,"Rolling week","Weekly"
"rollingweek_2022_02_07","Week end 07/02/2022",2022-02-01 00:00:00.000,2022-02-07 23:59:59.000,"Rolling week","Weekly"
"rollingweek_2022_02_08","Week end 08/02/2022",2022-02-02 00:00:00.000,2022-02-08 23:59:59.000,"Rolling week","Weekly"
"rollingweek_2022_02_09","Week end 09/02/2022",2022-02-03 00:00:00.000,2022-02-09 23:59:59.000,"Rolling week","Weekly"
"rollingweek_2022_02_10","Week end 10/02/2022",2022-02-04 00:00:00.000,2022-02-10 23:59:59.000,"Rolling week","Weekly"
"rollingweek_2022_02_11","Week end 11/02/2022",2022-02-05 00:00:00.000,2022-02-11 23:59:59.000,"Rolling week","Weekly"
"rollingweek_2022_02_12","Week end 12/02/2022",2022-02-06 00:00:00.000,2022-02-12 23:59:59.000,"Rolling week","Weekly"
"rollingweek_2022_02_13","Week end 13/02/2022",2022-02-07 00:00:00.000,2022-02-13 23:59:59.000,"Rolling week","Weekly"
"rollingweek_2022_02_14","Week end 14/02/2022",2022-02-08 00:00:00.000,2022-02-14 23:59:59.000,"Rolling week","Weekly"
"rollingweek_2022_02_15","Week end 15/02/2022",2022-02-09 00:00:00.000,2022-02-15 23:59:59.000,"Rolling week","Weekly"
"rollingweek_2022_02_16","Week end 16/02/2022",2022-02-10 00:00:00.000,2022-02-16 23:59:59.000,"Rolling week","Weekly"
"rollingweek_2022_02_17","Week end 17/02/2022",2022-02-11 00:00:00.000,2022-02-17 23:59:59.000,"Rolling week","Weekly"
"rollingweek_2022_02_18","Week end 18/02/2022",2022-02-12 00:00:00.000,2022-02-18 23:59:59.000,"Rolling week","Weekly"
"rollingweek_2022_02_19","Week end 19/02/2022",2022-02-13 00:00:00.000,2022-02-19 23:59:59.000,"Rolling week","Weekly"
"rollingweek_2022_02_20","Week end 20/02/2022",2022-02-14 00:00:00.000,2022-02-20 23:59:59.000,"Rolling week","Weekly"
"rollingweek_2022_02_21","Week end 21/02/2022",2022-02-15 00:00:00.000,2022-02-21 23:59:59.000,"Rolling week","Weekly"
"rollingweek_2022_02_22","Week end 22/02/2022",2022-02-16 00:00:00.000,2022-02-22 23:59:59.000,"Rolling week","Weekly"
"rollingweek_2022_02_23","Week end 23/02/2022",2022-02-17 00:00:00.000,2022-02-23 23:59:59.000,"Rolling week","Weekly"
"rollingweek_2022_02_24","Week end 24/02/2022",2022-02-18 00:00:00.000,2022-02-24 23:59:59.000,"Rolling week","Weekly"
"rollingweek_2022_02_25","Week end 25/02/2022",2022-02-19 00:00:00.000,2022-02-25 23:59:59.000,"Rolling week","Weekly"
"rollingweek_2022_02_26","Week end 26/02/2022",2022-02-20 00:00:00.000,2022-02-26 23:59:59.000,"Rolling week","Weekly"
"rollingweek_2022_02_27","Week end 27/02/2022",2022-02-21 00:00:00.000,2022-02-27 23:59:59.000,"Rolling week","Weekly"
"rollingweek_2022_02_28","Week end 28/02/2022",2022-02-22 00:00:00.000,2022-02-28 23:59:59.000,"Rolling week","Weekly"
"rollingweek_2022_03_01","Week end 01/03/2022",2022-02-23 00:00:00.000,2022-03-01 23:59:59.000,"Rolling week","Weekly"
"rollingweek_2022_03_02","Week end 02/03/2022",2022-02-24 00:00:00.000,2022-03-02 23:59:59.000,"Rolling week","Weekly"
"rollingweek_2022_03_03","Week end 03/03/2022",2022-02-25 00:00:00.000,2022-03-03 23:59:59.000,"Rolling week","Weekly"
"rollingweek_2022_03_04","Week end 04/03/2022",2022-02-26 00:00:00.000,2022-03-04 23:59:59.000,"Rolling week","Weekly"
"rollingweek_2022_03_05","Week end 05/03/2022",2022-02-27 00:00:00.000,2022-03-05 23:59:59.000,"Rolling week","Weekly"
"rollingweek_2022_03_06","Week end 06/03/2022",2022-02-28 00:00:00.000,2022-03-06 23:59:59.000,"Rolling week","Weekly"
"rollingweek_2022_03_07","Week end 07/03/2022",2022-03-01 00:00:00.000,2022-03-07 23:59:59.000,"Rolling week","Weekly"
"rollingweek_2022_03_08","Week end 08/03/2022",2022-03-02 00:00:00.000,2022-03-08 23:59:59.000,"Rolling week","Weekly"
"rollingweek_2022_03_09","Week end 09/03/2022",2022-03-03 00:00:00.000,2022-03-09 23:59:59.000,"Rolling week","Weekly"
"rollingweek_2022_03_10","Week end 10/03/2022",2022-03-04 00:00:00.000,2022-03-10 23:59:59.000,"Rolling week","Weekly"
"rollingweek_2022_03_11","Week end 11/03/2022",2022-03-05 00:00:00.000,2022-03-11 23:59:59.000,"Rolling week","Weekly"
"rollingweek_2022_03_12","Week end 12/03/2022",2022-03-06 00:00:00.000,2022-03-12 23:59:59.000,"Rolling week","Weekly"
"rollingweek_2022_03_13","Week end 13/03/2022",2022-03-07 00:00:00.000,2022-03-13 23:59:59.000,"Rolling week","Weekly"
"rollingweek_2022_03_14","Week end 14/03/2022",2022-03-08 00:00:00.000,2022-03-14 23:59:59.000,"Rolling week","Weekly"
"rollingweek_2022_03_15","Week end 15/03/2022",2022-03-09 00:00:00.000,2022-03-15 23:59:59.000,"Rolling week","Weekly"
"rollingweek_2022_03_16","Week end 16/03/2022",2022-03-10 00:00:00.000,2022-03-16 23:59:59.000,"Rolling week","Weekly"
"rollingweek_2022_03_17","Week end 17/03/2022",2022-03-11 00:00:00.000,2022-03-17 23:59:59.000,"Rolling week","Weekly"
"rollingweek_2022_03_18","Week end 18/03/2022",2022-03-12 00:00:00.000,2022-03-18 23:59:59.000,"Rolling week","Weekly"
"rollingweek_2022_03_19","Week end 19/03/2022",2022-03-13 00:00:00.000,2022-03-19 23:59:59.000,"Rolling week","Weekly"
"rollingweek_2022_03_20","Week end 20/03/2022",2022-03-14 00:00:00.000,2022-03-20 23:59:59.000,"Rolling week","Weekly"
"rollingweek_2022_03_21","Week end 21/03/2022",2022-03-15 00:00:00.000,2022-03-21 23:59:59.000,"Rolling week","Weekly"
"rollingweek_2022_03_22","Week end 22/03/2022",2022-03-16 00:00:00.000,2022-03-22 23:59:59.000,"Rolling week","Weekly"
"rollingweek_2022_03_23","Week end 23/03/2022",2022-03-17 00:00:00.000,2022-03-23 23:59:59.000,"Rolling week","Weekly"
"rollingweek_2022_03_24","Week end 24/03/2022",2022-03-18 00:00:00.000,2022-03-24 23:59:59.000,"Rolling week","Weekly"
"rollingweek_2022_03_25","Week end 25/03/2022",2022-03-19 00:00:00.000,2022-03-25 23:59:59.000,"Rolling week","Weekly"
"rollingweek_2022_03_26","Week end 26/03/2022",2022-03-20 00:00:00.000,2022-03-26 23:59:59.000,"Rolling week","Weekly"
"rollingweek_2022_03_27","Week end 27/03/2022",2022-03-21 00:00:00.000,2022-03-27 23:59:59.000,"Rolling week","Weekly"
"rollingweek_2022_03_28","Week end 28/03/2022",2022-03-22 00:00:00.000,2022-03-28 23:59:59.000,"Rolling week","Weekly"
"rollingweek_2022_03_29","Week end 29/03/2022",2022-03-23 00:00:00.000,2022-03-29 23:59:59.000,"Rolling week","Weekly"
"rollingweek_2022_03_30","Week end 30/03/2022",2022-03-24 00:00:00.000,2022-03-30 23:59:59.000,"Rolling week","Weekly"
"rollingweek_2022_03_31","Week end 31/03/2022",2022-03-25 00:00:00.000,2022-03-31 23:59:59.000,"Rolling week","Weekly"
"rollingweek_2022_04_01","Week end 01/04/2022",2022-03-26 00:00:00.000,2022-04-01 23:59:59.000,"Rolling week","Weekly"
"rollingweek_2022_04_02","Week end 02/04/2022",2022-03-27 00:00:00.000,2022-04-02 23:59:59.000,"Rolling week","Weekly"
"rollingweek_2022_04_03","Week end 03/04/2022",2022-03-28 00:00:00.000,2022-04-03 23:59:59.000,"Rolling week","Weekly"
"rollingweek_2022_04_04","Week end 04/04/2022",2022-03-29 00:00:00.000,2022-04-04 23:59:59.000,"Rolling week","Weekly"
"rollingweek_2022_04_05","Week end 05/04/2022",2022-03-30 00:00:00.000,2022-04-05 23:59:59.000,"Rolling week","Weekly"
"rollingweek_2022_04_06","Week end 06/04/2022",2022-03-31 00:00:00.000,2022-04-06 23:59:59.000,"Rolling week","Weekly"
"rollingweek_2022_04_07","Week end 07/04/2022",2022-04-01 00:00:00.000,2022-04-07 23:59:59.000,"Rolling week","Weekly"
"rollingweek_2022_04_08","Week end 08/04/2022",2022-04-02 00:00:00.000,2022-04-08 23:59:59.000,"Rolling week","Weekly"
"rollingweek_2022_04_09","Week end 09/04/2022",2022-04-03 00:00:00.000,2022-04-09 23:59:59.000,"Rolling week","Weekly"
"rollingweek_2022_04_10","Week end 10/04/2022",2022-04-04 00:00:00.000,2022-04-10 23:59:59.000,"Rolling week","Weekly"
"rollingweek_2022_04_11","Week end 11/04/2022",2022-04-05 00:00:00.000,2022-04-11 23:59:59.000,"Rolling week","Weekly"
"rollingweek_2022_04_12","Week end 12/04/2022",2022-04-06 00:00:00.000,2022-04-12 23:59:59.000,"Rolling week","Weekly"
"rollingweek_2022_04_13","Week end 13/04/2022",2022-04-07 00:00:00.000,2022-04-13 23:59:59.000,"Rolling week","Weekly"
"rollingweek_2022_04_14","Week end 14/04/2022",2022-04-08 00:00:00.000,2022-04-14 23:59:59.000,"Rolling week","Weekly"
"rollingweek_2022_04_15","Week end 15/04/2022",2022-04-09 00:00:00.000,2022-04-15 23:59:59.000,"Rolling week","Weekly"
